A1: Sección de Estadística
A2: Universidad de Granada
A3: Curso Académico 2011/2012
A4: Grado. Alumnado matriculado: distribución por edad.
A7: CENTRO | B7: TOTAL CENTRO | C7: TITULACIÓN | D7: TOTAL TITULAC | E7: SEXO | F7: <=18 | G7: 19 | H7: 20 | I7: 21 | J7: 22 | K7: 23 | L7: 24 | M7: 25 | N7: 26 | O7: 27 | P7: 28 | Q7: 29 | R7: 30-34 | S7: 35-39 | T7: >=40 | U7: TOTAL SEXO
A8: Universidad de Granada | B8: =U8+U9 -> 56813 | E8: Hombre | F8: 2100 | G8: 2594 | H8: 3030 | I8: 3389 | J8: 3030 | K8: 2543 | L8: 1964 | M8: 1488 | N8: 1110 | O8: 790 | P8: 596 | Q8: 507 | R8: 1422 | S8: 581 | T8: 724 | U8: =F8+G8+H8+I8+K8+J8+L8+M8+N8+O8+P8+Q8+R8+S8+T8 -> 25868
E9: Mujer | F9: 3288 | G9: 3720 | H9: 4004 | I9: 3795 | J9: 3660 | K9: 2888 | L9: 2095 | M9: 1504 | N9: 1216 | O9: 839 | P9: 627 | Q9: 495 | R9: 1429 | S9: 586 | T9: 799 | U9: =F9+G9+H9+I9+J9+K9+L9+M9+N9+O9+P9+Q9+R9+S9+T9 -> 30945
A11: FAC. BELLAS ARTES | B11: 1402 | C11: GRADO EN BELLAS ARTES | D11: =U11+U12 -> 465 | E11: Hombre | F11: 20 | G11: 32 | H11: 21 | I11: 20 | J11: 19 | K11: 11 | L11: 11 | M11: 5 | N11: 5 | O11: 6 | P11: 2 | Q11: 0 | R11: 6 | S11: 4 | T11: 13 | U11: =F11+G11+H11+I11+J11+K11+L11+M11+N11+O11+P11+Q11+R11+S11+T11 -> 175
C12: GRADO EN BELLAS ARTES | E12: Mujer | F12: 62 | G12: 78 | H12: 42 | I12: 22 | J12: 17 | K12: 7 | L12: 7 | M12: 6 | N12: 6 | O12: 7 | P12: 2 | Q12: 2 | R12: 5 | S12: 5 | T12: 22 | U12: =F12+G12+H12+I12+J12+K12+L12+M12+N12+O12+P12+Q12+R12+S12+T12 -> 290
C13: GRADO EN CONSERVACIÓN Y RESTAURACIÓN DE BIENES CULTURALES | D13: =U13+U14 -> 100 | E13: Hombre | F13: 3 | G13: 4 | H13: 2 | I13: 2 | J13: 1 | K13: 1 | L13: 1 | M13: 0 | N13: 2 | O13: 0 | P13: 0 | Q13: 0 | R13: 4 | S13: 1 | T13: 3 | U13: =F13+G13+H13+I13+J13+K13+L13+M13+N13+O13+P13+Q13+R13+S13+T13 -> 24
C14: GRADO EN CONSERVACIÓN Y RESTAURACIÓN DE BIENES CULTURALES | E14: Mujer | F14: 11 | G14: 13 | H14: 11 | I14: 6 | J14: 3 | K14: 3 | L14: 6 | M14: 5 | N14: 6 | O14: 0 | P14: 1 | Q14: 2 | R14: 5 | S14: 0 | T14: 4 | U14: =F14+G14+H14+I14+J14+K14+L14+M14+N14+O14+P14+Q14+R14+S14+T14 -> 76
C15: LICENCIADO EN BELLAS ARTES | D15: =U15+U16 -> 837 | E15: Hombre | F15: 0 | G15: 2 | H15: 25 | I15: 58 | J15: 46 | K15: 50 | L15: 45 | M15: 22 | N15: 17 | O15: 14 | P15: 11 | Q15: 5 | R15: 36 | S15: 7 | T15: 18 | U15: =F15+G15+H15+I15+J15+K15+L15+M15+N15+O15+P15+Q15+R15+S15+T15 -> 356
C16: LICENCIADO EN BELLAS ARTES | E16: Mujer | F16: 0 | G16: 1 | H16: 68 | I16: 83 | J16: 77 | K16: 58 | L16: 52 | M16: 29 | N16: 25 | O16: 12 | P16: 10 | Q16: 7 | R16: 22 | S16: 7 | T16: 30 | U16: =F16+G16+H16+I16+J16+K16+L16+M16+N16+O16+P16+Q16+R16+S16+T16 -> 481
A17: FAC. CIENCIAS | B17: =D17+D19+D21+D23+D25+D27+D29+D31+D33+D35+D37+D39+D41+D43+D45+D47+D49+D51+D53+D55+D57+D59+D61 -> 5528 | C17: DIPLOMADO EN ESTADÍSTICA | D17: =U17+U18 -> 51 | E17: Hombre | F17: 0 | G17: 0 | H17: 3 | I17: 0 | J17: 2 | K17: 3 | L17: 0 | M17: 1 | N17: 1 | O17: 2 | P17: 1 | Q17: 3 | R17: 2 | S17: 3 | T17: 2 | U17: =F17+G17+H17+I17+J17+K17+L17+M17+N17+O17+P17+Q17+R17+S17+T17 -> 23
C18: DIPLOMADO EN ESTADÍSTICA | E18: Mujer | F18: 0 | G18: 0 | H18: 3 | I18: 1 | J18: 2 | K18: 1 | L18: 5 | M18: 4 | N18: 0 | O18: 1 | P18: 1 | Q18: 1 | R18: 6 | S18: 1 | T18: 2 | U18: =F18+G18+H18+I18+J18+K18+L18+M18+N18+O18+P18+Q18+R18+S18+T18 -> 28
C19: DIPLOMADO EN ÓPTICA Y OPTOMETRÍA | D19: =U19+U20 -> 249 | E19: Hombre | F19: 0 | G19: 0 | H19: 8 | I19: 11 | J19: 12 | K19: 10 | L19: 5 | M19: 7 | N19: 3 | O19: 5 | P19: 3 | Q19: 4 | R19: 7 | S19: 4 | T19: 3 | U19: =F19+G19+H19+I19+J19+K19+L19+M19+N19+O19+P19+Q19+R19+S19+T19 -> 82
C20: DIPLOMADO EN ÓPTICA Y OPTOMETRÍA | E20: Mujer | F20: 0 | G20: 0 | H20: 42 | I20: 46 | J20: 24 | K20: 16 | L20: 11 | M20: 7 | N20: 5 | O20: 2 | P20: 4 | Q20: 1 | R20: 4 | S20: 5 | T20: 0 | U20: =F20+G20+H20+I20+J20+K20+L20+M20+N20+O20+P20+Q20+R20+S20+T20 -> 167
C21: GRADO EN BIOLOGÍA | D21: =U21+U22 -> 510 | E21: Hombre | F21: 71 | G21: 77 | H21: 31 | I21: 16 | J21: 13 | K21: 10 | L21: 6 | M21: 7 | N21: 3 | O21: 2 | P21: 2 | Q21: 1 | R21: 1 | S21: 1 | T21: 1 | U21: =F21+G21+H21+I21+J21+K21+L21+M21+N21+O21+P21+Q21+R21+S21+T21 -> 242
C22: GRADO EN BIOLOGÍA | E22: Mujer | F22: 101 | G22: 89 | H22: 40 | I22: 13 | J22: 9 | K22: 4 | L22: 3 | M22: 1 | N22: 2 | O22: 3 | P22: 0 | Q22: 2 | R22: 1 | S22: 0 | T22: 0 | U22: =F22+G22+H22+I22+J22+K22+L22+M22+N22+O22+P22+Q22+R22+S22+T22 -> 268
C23: GRADO EN BIOQUÍMICA | D23: =U23+U24 -> 89 | E23: Hombre | F23: 11 | G23: 18 | H23: 1 | I23: 1 | J23: 0 | K23: 0 | L23: 0 | M23: 1 | N23: 0 | O23: 0 | P23: 0 | Q23: 0 | R23: 0 | S23: 0 | T23: 0 | U23: =F23+G23+H23+I23+J23+K23+L23+M23+N23+O23+P23+Q23+R23+S23+T23 -> 32
C24: GRADO EN BIOQUÍMICA | E24: Mujer | F24: 21 | G24: 31 | H24: 2 | I24: 0 | J24: 0 | K24: 0 | L24: 0 | M24: 0 | N24: 0 | O24: 0 | P24: 2 | Q24: 0 | R24: 1 | S24: 0 | T24: 0 | U24: =F24+G24+H24+I24+J24+K24+L24+M24+N24+O24+P24+Q24+R24+S24+T24 -> 57
C25: GRADO EN CIENCIAS AMBIENTALES | D25: =U25+U26 -> 268 | E25: Hombre | F25: 34 | G25: 37 | H25: 31 | I25: 18 | J25: 13 | K25: 6 | L25: 5 | M25: 3 | N25: 1 | O25: 4 | P25: 3 | Q25: 1 | R25: 3 | S25: 2 | T25: 2 | U25: =F25+G25+H25+I25+J25+K25+L25+M25+N25+O25+P25+Q25+R25+S25+T25 -> 163
C26: GRADO EN CIENCIAS AMBIENTALES | E26: Mujer | F26: 36 | G26: 30 | H26: 14 | I26: 8 | J26: 5 | K26: 3 | L26: 6 | M26: 1 | N26: 0 | O26: 0 | P26: 0 | Q26: 0 | R26: 1 | S26: 0 | T26: 1 | U26: =F26+G26+H26+I26+J26+K26+L26+M26+N26+O26+P26+Q26+R26+S26+T26 -> 105
C27: GRADO EN ESTADÍSTICA | D27: =U27+U28 -> 85 | E27: Hombre | F27: 9 | G27: 22 | H27: 10 | I27: 7 | J27: 0 | K27: 3 | L27: 0 | M27: 1 | N27: 1 | O27: 0 | P27: 0 | Q27: 0 | R27: 1 | S27: 2 | T27: 1 | U27: =F27+G27+H27+I27+J27+K27+L27+M27+N27+O27+P27+Q27+R27+S27+T27 -> 57
C28: GRADO EN ESTADÍSTICA | E28: Mujer | F28: 8 | G28: 8 | H28: 6 | I28: 1 | J28: 3 | K28: 1 | L28: 0 | M28: 0 | N28: 0 | O28: 0 | P28: 0 | Q28: 0 | R28: 0 | S28: 1 | T28: 0 | U28: =F28+G28+H28+I28+J28+K28+L28+M28+N28+O28+P28+Q28+R28+S28+T28 -> 28
C29: GRADO EN FÍSICA | D29: =U29+U30 -> 184 | E29: Hombre | F29: 47 | G29: 45 | H29: 19 | I29: 9 | J29: 1 | K29: 7 | L29: 2 | M29: 2 | N29: 0 | O29: 2 | P29: 3 | Q29: 0 | R29: 1 | S29: 0 | T29: 1 | U29: =F29+G29+H29+I29+J29+K29+L29+M29+N29+O29+P29+Q29+R29+S29+T29 -> 139
C30: GRADO EN FÍSICA | E30: Mujer | F30: 21 | G30: 14 | H30: 7 | I30: 0 | J30: 3 | K30: 0 | L30: 0 | M30: 0 | N30: 0 | O30: 0 | P30: 0 | Q30: 0 | R30: 0 | S30: 0 | T30: 0 | U30: =F30+G30+H30+I30+J30+K30+L30+M30+N30+O30+P30+Q30+R30+S30+T30 -> 45
C31: GRADO EN GEOLOGÍA | D31: =U31+U32 -> 112 | E31: Hombre | F31: 20 | G31: 23 | H31: 8 | I31: 6 | J31: 2 | K31: 4 | L31: 2 | M31: 5 | N31: 1 | O31: 0 | P31: 1 | Q31: 0 | R31: 1 | S31: 0 | T31: 0 | U31: =F31+G31+H31+I31+J31+K31+L31+M31+N31+O31+P31+Q31+R31+S31+T31 -> 73
C32: GRADO EN GEOLOGÍA | E32: Mujer | F32: 15 | G32: 11 | H32: 5 | I32: 3 | J32: 1 | K32: 0 | L32: 1 | M32: 0 | N32: 1 | O32: 1 | P32: 0 | Q32: 1 | R32: 0 | S32: 0 | T32: 0 | U32: =F32+G32+H32+I32+J32+K32+L32+M32+N32+O32+P32+Q32+R32+S32+T32 -> 39
C33: GRADO EN INGENIERÍA ELECTRÓNICA INDUSTRIAL | D33: =U33+U34 -> 68 | E33: Hombre | F33: 29 | G33: 15 | H33: 1 | I33: 1 | J33: 2 | K33: 3 | L33: 1 | M33: 1 | N33: 1 | O33: 1 | P33: 1 | Q33: 0 | R33: 1 | S33: 0 | T33: 1 | U33: =F33+G33+H33+I33+J33+K33+L33+M33+N33+O33+P33+Q33+R33+S33+T33 -> 58
C34: GRADO EN INGENIERÍA ELECTRÓNICA INDUSTRIAL | E34: Mujer | F34: 9 | G34: 1 | H34: 0 | I34: 0 | J34: 0 | K34: 0 | L34: 0 | M34: 0 | N34: 0 | O34: 0 | P34: 0 | Q34: 0 | R34: 0 | S34: 0 | T34: 0 | U34: =F34+G34+H34+I34+J34+K34+L34+M34+N34+O34+P34+Q34+R34+S34+T34 -> 10
C35: GRADO EN INGENIERÍA QUÍMICA | D35: =U35+U36 -> 212 | E35: Hombre | F35: 54 | G35: 42 | H35: 12 | I35: 5 | J35: 4 | K35: 2 | L35: 2 | M35: 1 | N35: 0 | O35: 2 | P35: 0 | Q35: 0 | R35: 1 | S35: 1 | T35: 0 | U35: =F35+G35+H35+I35+J35+K35+L35+M35+N35+O35+P35+Q35+R35+S35+T35 -> 126
C36: GRADO EN INGENIERÍA QUÍMICA | E36: Mujer | F36: 40 | G36: 32 | H36: 9 | I36: 3 | J36: 1 | K36: 1 | L36: 0 | M36: 0 | N36: 0 | O36: 0 | P36: 0 | Q36: 0 | R36: 0 | S36: 0 | T36: 0 | U36: =F36+G36+H36+I36+J36+K36+L36+M36+N36+O36+P36+Q36+R36+S36+T36 -> 86
C37: GRADO EN MATEMÁTICAS | D37: =U37+U38 -> 197 | E37: Hombre | F37: 41 | G37: 42 | H37: 8 | I37: 1 | J37: 3 | K37: 0 | L37: 2 | M37: 1 | N37: 0 | O37: 1 | P37: 1 | Q37: 0 | R37: 0 | S37: 1 | T37: 1 | U37: =F37+G37+H37+I37+J37+K37+L37+M37+N37+O37+P37+Q37+R37+S37+T37 -> 102
C38: GRADO EN MATEMÁTICAS | E38: Mujer | F38: 46 | G38: 36 | H38: 4 | I38: 3 | J38: 4 | K38: 0 | L38: 1 | M38: 0 | N38: 0 | O38: 0 | P38: 0 | Q38: 0 | R38: 0 | S38: 0 | T38: 1 | U38: =F38+G38+H38+I38+J38+K38+L38+M38+N38+O38+P38+Q38+R38+S38+T38 -> 95
C39: GRADO EN QUÍMICA | D39: =U39+U40 -> 176 | E39: Hombre | F39: 28 | G39: 33 | H39: 11 | I39: 6 | J39: 0 | K39: 7 | L39: 0 | M39: 0 | N39: 0 | O39: 1 | P39: 0 | Q39: 0 | R39: 2 | S39: 0 | T39: 0 | U39: =F39+G39+H39+I39+J39+K39+L39+M39+N39+O39+P39+Q39+R39+S39+T39 -> 88
C40: GRADO EN QUÍMICA | E40: Mujer | F40: 30 | G40: 30 | H40: 10 | I40: 8 | J40: 1 | K40: 2 | L40: 0 | M40: 1 | N40: 2 | O40: 1 | P40: 2 | Q40: 0 | R40: 1 | S40: 0 | T40: 0 | U40: =F40+G40+H40+I40+J40+K40+L40+M40+N40+O40+P40+Q40+R40+S40+T40 -> 88
C41: GRADO EN ÓPTICA Y OPTOMETRÍA | D41: =U41+U42 -> 249 | E41: Hombre | F41: 16 | G41: 21 | H41: 8 | I41: 9 | J41: 7 | K41: 5 | L41: 2 | M41: 3 | N41: 1 | O41: 2 | P41: 1 | Q41: 1 | R41: 3 | S41: 0 | T41: 0 | U41: =F41+G41+H41+I41+J41+K41+L41+M41+N41+O41+P41+Q41+R41+S41+T41 -> 79
C42: GRADO EN ÓPTICA Y OPTOMETRÍA | E42: Mujer | F42: 49 | G42: 59 | H42: 30 | I42: 15 | J42: 4 | K42: 5 | L42: 3 | M42: 1 | N42: 0 | O42: 1 | P42: 0 | Q42: 0 | R42: 1 | S42: 0 | T42: 2 | U42: =F42+G42+H42+I42+J42+K42+L42+M42+N42+O42+P42+Q42+R42+S42+T42 -> 170
C43: INGENIERO EN ELECTRÓNICA | D43: =U43+U44 -> 109 | E43: Hombre | F43: 0 | G43: 0 | H43: 0 | I43: 1 | J43: 8 | K43: 9 | L43: 10 | M43: 14 | N43: 13 | O43: 2 | P43: 4 | Q43: 1 | R43: 16 | S43: 7 | T43: 11 | U43: =F43+G43+H43+I43+J43+K43+L43+M43+N43+O43+P43+Q43+R43+S43+T43 -> 96
C44: INGENIERO EN ELECTRÓNICA | E44: Mujer | F44: 0 | G44: 0 | H44: 0 | I44: 0 | J44: 1 | K44: 0 | L44: 2 | M44: 1 | N44: 4 | O44: 1 | P44: 0 | Q44: 1 | R44: 2 | S44: 1 | T44: 0 | U44: =F44+G44+H44+I44+J44+K44+L44+M44+N44+O44+P44+Q44+R44+S44+T44 -> 13
C45: INGENIERO QUÍMICO | D45: =U45+U46 -> 436 | E45: Hombre | F45: 0 | G45: 0 | H45: 14 | I45: 30 | J45: 30 | K45: 34 | L45: 19 | M45: 21 | N45: 18 | O45: 11 | P45: 10 | Q45: 14 | R45: 24 | S45: 5 | T45: 4 | U45: =F45+G45+H45+I45+J45+K45+L45+M45+N45+O45+P45+Q45+R45+S45+T45 -> 234
C46: INGENIERO QUÍMICO | E46: Mujer | F46: 0 | G46: 0 | H46: 23 | I46: 27 | J46: 24 | K46: 22 | L46: 23 | M46: 20 | N46: 15 | O46: 13 | P46: 13 | Q46: 8 | R46: 11 | S46: 2 | T46: 1 | U46: =F46+G46+H46+I46+J46+K46+L46+M46+N46+O46+P46+Q46+R46+S46+T46 -> 202
C47: LICENCIADO EN BIOLOGÍA | D47: =U47+U48 -> 837 | E47: Hombre | F47: 0 | G47: 1 | H47: 38 | I47: 54 | J47: 39 | K47: 40 | L47: 35 | M47: 26 | N47: 20 | O47: 18 | P47: 10 | Q47: 10 | R47: 23 | S47: 8 | T47: 4 | U47: =F47+G47+H47+I47+J47+K47+L47+M47+N47+O47+P47+Q47+R47+S47+T47 -> 326
C48: LICENCIADO EN BIOLOGÍA | E48: Mujer | F48: 0 | G48: 0 | H48: 58 | I48: 74 | J48: 83 | K48: 73 | L48: 57 | M48: 39 | N48: 21 | O48: 24 | P48: 18 | Q48: 11 | R48: 44 | S48: 5 | T48: 4 | U48: =F48+G48+H48+I48+J48+K48+L48+M48+N48+O48+P48+Q48+R48+S48+T48 -> 511
C49: LICENCIADO EN BIOQUÍMICA | D49: =U49+U50 -> 81 | E49: Hombre | F49: 0 | G49: 0 | H49: 0 | I49: 8 | J49: 6 | K49: 7 | L49: 3 | M49: 2 | N49: 1 | O49: 2 | P49: 0 | Q49: 0 | R49: 5 | S49: 1 | T49: 0 | U49: =F49+G49+H49+I49+J49+K49+L49+M49+N49+O49+P49+Q49+R49+S49+T49 -> 35
C50: LICENCIADO EN BIOQUÍMICA | E50: Mujer | F50: 0 | G50: 0 | H50: 0 | I50: 4 | J50: 7 | K50: 9 | L50: 11 | M50: 2 | N50: 4 | O50: 2 | P50: 1 | Q50: 0 | R50: 3 | S50: 1 | T50: 2 | U50: =F50+G50+H50+I50+J50+K50+L50+M50+N50+O50+P50+Q50+R50+S50+T50 -> 46
C51: LICENCIADO EN CIENCIAS AMBIENTALES | D51: =U51+U52 -> 583 | E51: Hombre | F51: 0 | G51: 0 | H51: 28 | I51: 49 | J51: 46 | K51: 40 | L51: 35 | M51: 37 | N51: 20 | O51: 14 | P51: 19 | Q51: 6 | R51: 12 | S51: 4 | T51: 9 | U51: =F51+G51+H51+I51+J51+K51+L51+M51+N51+O51+P51+Q51+R51+S51+T51 -> 319
C52: LICENCIADO EN CIENCIAS AMBIENTALES | E52: Mujer | F52: 0 | G52: 0 | H52: 23 | I52: 32 | J52: 55 | K52: 33 | L52: 26 | M52: 29 | N52: 23 | O52: 18 | P52: 9 | Q52: 2 | R52: 12 | S52: 1 | T52: 1 | U52: =F52+G52+H52+I52+J52+K52+L52+M52+N52+O52+P52+Q52+R52+S52+T52 -> 264
C53: LICENCIADO EN CIENCIAS Y TÉCNICAS ESTADÍSTICAS | D53: =U53+U54 -> 47 | E53: Hombre | F53: 0 | G53: 0 | H53: 0 | I53: 0 | J53: 5 | K53: 1 | L53: 5 | M53: 2 | N53: 2 | O53: 1 | P53: 2 | Q53: 3 | R53: 2 | S53: 1 | T53: 0 | U53: =F53+G53+H53+I53+J53+K53+L53+M53+N53+O53+P53+Q53+R53+S53+T53 -> 24
C54: LICENCIADO EN CIENCIAS Y TÉCNICAS ESTADÍSTICAS | E54: Mujer | F54: 0 | G54: 0 | H54: 0 | I54: 3 | J54: 2 | K54: 3 | L54: 3 | M54: 2 | N54: 0 | O54: 2 | P54: 0 | Q54: 1 | R54: 5 | S54: 1 | T54: 1 | U54: =F54+G54+H54+I54+J54+K54+L54+M54+N54+O54+P54+Q54+R54+S54+T54 -> 23
C55: LICENCIADO EN FÍSICA | D55: =U55+U56 -> 321 | E55: Hombre | F55: 0 | G55: 0 | H55: 23 | I55: 21 | J55: 35 | K55: 31 | L55: 20 | M55: 19 | N55: 15 | O55: 10 | P55: 14 | Q55: 5 | R55: 27 | S55: 12 | T55: 4 | U55: =F55+G55+H55+I55+J55+K55+L55+M55+N55+O55+P55+Q55+R55+S55+T55 -> 236
C56: LICENCIADO EN FÍSICA | E56: Mujer | F56: 0 | G56: 0 | H56: 15 | I56: 7 | J56: 15 | K56: 16 | L56: 5 | M56: 6 | N56: 4 | O56: 3 | P56: 2 | Q56: 3 | R56: 9 | S56: 0 | T56: 0 | U56: =F56+G56+H56+I56+J56+K56+L56+M56+N56+O56+P56+Q56+R56+S56+T56 -> 85
C57: LICENCIADO EN GEOLOGÍA | D57: =U57+U58 -> 139 | E57: Hombre | F57: 0 | G57: 0 | H57: 5 | I57: 13 | J57: 13 | K57: 11 | L57: 8 | M57: 5 | N57: 8 | O57: 4 | P57: 5 | Q57: 5 | R57: 11 | S57: 4 | T57: 2 | U57: =F57+G57+H57+I57+J57+K57+L57+M57+N57+O57+P57+Q57+R57+S57+T57 -> 94
C58: LICENCIADO EN GEOLOGÍA | E58: Mujer | F58: 0 | G58: 0 | H58: 5 | I58: 10 | J58: 2 | K58: 4 | L58: 4 | M58: 5 | N58: 2 | O58: 1 | P58: 1 | Q58: 3 | R58: 8 | S58: 0 | T58: 0 | U58: =F58+G58+H58+I58+J58+K58+L58+M58+N58+O58+P58+Q58+R58+S58+T58 -> 45
C59: LICENCIADO EN MATEMÁTICAS | D59: =U59+U60 -> 243 | E59: Hombre | F59: 0 | G59: 1 | H59: 17 | I59: 30 | J59: 31 | K59: 19 | L59: 8 | M59: 7 | N59: 11 | O59: 8 | P59: 2 | Q59: 6 | R59: 6 | S59: 1 | T59: 5 | U59: =F59+G59+H59+I59+J59+K59+L59+M59+N59+O59+P59+Q59+R59+S59+T59 -> 152
C60: LICENCIADO EN MATEMÁTICAS | E60: Mujer | F60: 0 | G60: 1 | H60: 17 | I60: 19 | J60: 16 | K60: 8 | L60: 6 | M60: 8 | N60: 4 | O60: 5 | P60: 1 | Q60: 0 | R60: 4 | S60: 2 | T60: 0 | U60: =F60+G60+H60+I60+J60+K60+L60+M60+N60+O60+P60+Q60+R60+S60+T60 -> 91
C61: LICENCIADO EN QUÍMICA | D61: =U61+U62 -> 282 | E61: Hombre | F61: 0 | G61: 0 | H61: 7 | I61: 19 | J61: 11 | K61: 12 | L61: 8 | M61: 13 | N61: 9 | O61: 6 | P61: 8 | Q61: 9 | R61: 21 | S61: 6 | T61: 4 | U61: =F61+G61+H61+I61+J61+K61+L61+M61+N61+O61+P61+Q61+R61+S61+T61 -> 133
C62: LICENCIADO EN QUÍMICA | E62: Mujer | F62: 0 | G62: 0 | H62: 8 | I62: 20 | J62: 13 | K62: 11 | L62: 14 | M62: 9 | N62: 12 | O62: 11 | P62: 8 | Q62: 8 | R62: 24 | S62: 10 | T62: 1 | U62: =F62+G62+H62+I62+J62+K62+L62+M62+N62+O62+P62+Q62+R62+S62+T62 -> 149
A63: FAC. CC. ACTV.FISICA Y DEPORTE | B63: =D63+D65 -> 1378 | C63: GRADO EN CIENCIAS DE LA ACTIVIDAD FÍSICA Y DEL DEPORTE | D63: =U63+U64 -> 361 | E63: Hombre | F63: 81 | G63: 87 | H63: 25 | I63: 25 | J63: 32 | K63: 8 | L63: 7 | M63: 4 | N63: 2 | O63: 0 | P63: 1 | Q63: 1 | R63: 4 | S63: 5 | T63: 3 | U63: =F63+G63+H63+I63+J63+K63+L63+M63+N63+O63+P63+Q63+R63+S63+T63 -> 285
C64: GRADO EN CIENCIAS DE LA ACTIVIDAD FÍSICA Y DEL DEPORTE | E64: Mujer | F64: 27 | G64: 28 | H64: 6 | I64: 7 | J64: 5 | K64: 0 | L64: 1 | M64: 1 | N64: 1 | O64: 0 | P64: 0 | Q64: 0 | R64: 0 | S64: 0 | T64: 0 | U64: =F64+G64+H64+I64+J64+K64+L64+M64+N64+O64+P64+Q64+R64+S64+T64 -> 76
C65: LICENCIADO EN CIENCIAS DE LA ACTIVIDAD FÍSICA Y DEL DEPORTE | D65: =U65+U66 -> 1017 | E65: Hombre | F65: 1 | G65: 9 | H65: 114 | I65: 171 | J65: 177 | K65: 119 | L65: 78 | M65: 38 | N65: 38 | O65: 22 | P65: 16 | Q65: 19 | R65: 33 | S65: 9 | T65: 3 | U65: =F65+G65+H65+I65+J65+K65+L65+M65+N65+O65+P65+Q65+R65+S65+T65 -> 847
C66: LICENCIADO EN CIENCIAS DE LA ACTIVIDAD FÍSICA Y DEL DEPORTE | E66: Mujer | F66: 0 | G66: 0 | H66: 34 | I66: 38 | J66: 27 | K66: 20 | L66: 16 | M66: 10 | N66: 6 | O66: 7 | P66: 3 | Q66: 3 | R66: 3 | S66: 3 | T66: 0 | U66: =F66+G66+H66+I66+J66+K66+L66+M66+N66+O66+P66+Q66+R66+S66+T66 -> 170
A67: FAC. CC. EDUCACION | B67: =D67+D69+D71+D73+D75+D77+D79+D81+D83+D85+D87+D89+D91+D93+D95 -> 5512 | C67: DIPLOMADO EN EDUCACIÓN SOCIAL | D67: =U67+U68 -> 106 | E67: Hombre | F67: 0 | G67: 0 | H67: 5 | I67: 2 | J67: 1 | K67: 3 | L67: 3 | M67: 0 | N67: 0 | O67: 1 | P67: 0 | Q67: 1 | R67: 3 | S67: 0 | T67: 1 | U67: =F67+G67+H67+I67+J67+K67+L67+M67+N67+O67+P67+Q67+R67+S67+T67 -> 20
C68: DIPLOMADO EN EDUCACIÓN SOCIAL | E68: Mujer | F68: 0 | G68: 0 | H68: 24 | I68: 6 | J68: 7 | K68: 15 | L68: 3 | M68: 9 | N68: 4 | O68: 2 | P68: 5 | Q68: 3 | R68: 3 | S68: 1 | T68: 4 | U68: =F68+G68+H68+I68+J68+K68+L68+M68+N68+O68+P68+Q68+R68+S68+T68 -> 86
C69: GRADO EN EDUCACIÓN SOCIAL | D69: =U69+U70 -> 243 | E69: Hombre | F69: 5 | G69: 6 | H69: 6 | I69: 4 | J69: 3 | K69: 5 | L69: 2 | M69: 2 | N69: 4 | O69: 1 | P69: 1 | Q69: 1 | R69: 0 | S69: 0 | T69: 1 | U69: =F69+G69+H69+I69+J69+K69+L69+M69+N69+O69+P69+Q69+R69+S69+T69 -> 41
C70: GRADO EN EDUCACIÓN SOCIAL | E70: Mujer | F70: 25 | G70: 41 | H70: 10 | I70: 32 | J70: 31 | K70: 24 | L70: 8 | M70: 11 | N70: 3 | O70: 6 | P70: 2 | Q70: 1 | R70: 4 | S70: 1 | T70: 3 | U70: =F70+G70+H70+I70+J70+K70+L70+M70+N70+O70+P70+Q70+R70+S70+T70 -> 202
C71: GRADO EN MAESTRO DE EDUCACIÓN INFANTIL | D71: =U71+U72 -> 579 | E71: Hombre | F71: 2 | G71: 4 | H71: 4 | I71: 2 | J71: 1 | K71: 1 | L71: 3 | M71: 3 | N71: 0 | O71: 2 | P71: 1 | Q71: 0 | R71: 1 | S71: 1 | T71: 1 | U71: =F71+G71+H71+I71+J71+K71+L71+M71+N71+O71+P71+Q71+R71+S71+T71 -> 26
C72: GRADO EN MAESTRO DE EDUCACIÓN INFANTIL | E72: Mujer | F72: 84 | G72: 136 | H72: 83 | I72: 53 | J72: 65 | K72: 43 | L72: 15 | M72: 15 | N72: 10 | O72: 8 | P72: 9 | Q72: 1 | R72: 20 | S72: 6 | T72: 5 | U72: =F72+G72+H72+I72+J72+K72+L72+M72+N72+O72+P72+Q72+R72+S72+T72 -> 553
C73: GRADO EN MAESTRO DE EDUCACIÓN PRIMARIA (BILINGÜE) | D73: =U73+U74 -> 67 | E73: Hombre | F73: 6 | G73: 3 | H73: 0 | I73: 1 | J73: 0 | K73: 0 | L73: 1 | M73: 1 | N73: 0 | O73: 0 | P73: 0 | Q73: 1 | R73: 1 | S73: 0 | T73: 0 | U73: =F73+G73+H73+I73+J73+K73+L73+M73+N73+O73+P73+Q73+R73+S73+T73 -> 14
C74: GRADO EN MAESTRO DE EDUCACIÓN PRIMARIA (BILINGÜE) | E74: Mujer | F74: 31 | G74: 8 | H74: 3 | I74: 3 | J74: 1 | K74: 0 | L74: 0 | M74: 1 | N74: 0 | O74: 1 | P74: 0 | Q74: 3 | R74: 1 | S74: 1 | T74: 0 | U74: =F74+G74+H74+I74+J74+K74+L74+M74+N74+O74+P74+Q74+R74+S74+T74 -> 53
C75: GRADO EN MAESTRO EN EDUCACIÓN PRIMARIA | D75: =U75+U76 -> 1295 | E75: Hombre | F75: 93 | G75: 177 | H75: 90 | I75: 56 | J75: 39 | K75: 29 | L75: 20 | M75: 11 | N75: 9 | O75: 9 | P75: 1 | Q75: 1 | R75: 16 | S75: 6 | T75: 1 | U75: =F75+G75+H75+I75+J75+K75+L75+M75+N75+O75+P75+Q75+R75+S75+T75 -> 558
C76: GRADO EN MAESTRO EN EDUCACIÓN PRIMARIA | E76: Mujer | F76: 163 | G76: 254 | H76: 92 | I76: 58 | J76: 52 | K76: 32 | L76: 18 | M76: 16 | N76: 9 | O76: 5 | P76: 4 | Q76: 6 | R76: 14 | S76: 9 | T76: 5 | U76: =F76+G76+H76+I76+J76+K76+L76+M76+N76+O76+P76+Q76+R76+S76+T76 -> 737
C77: GRADO EN PEDAGOGÍA | D77: =U77+U78 -> 216 | E77: Hombre | F77: 5 | G77: 10 | H77: 5 | I77: 5 | J77: 5 | K77: 3 | L77: 1 | M77: 0 | N77: 0 | O77: 0 | P77: 0 | Q77: 1 | R77: 2 | S77: 0 | T77: 2 | U77: =F77+G77+H77+I77+J77+K77+L77+M77+N77+O77+P77+Q77+R77+S77+T77 -> 39
C78: GRADO EN PEDAGOGÍA | E78: Mujer | F78: 33 | G78: 62 | H78: 39 | I78: 18 | J78: 8 | K78: 6 | L78: 5 | M78: 1 | N78: 1 | O78: 1 | P78: 0 | Q78: 0 | R78: 2 | S78: 0 | T78: 1 | U78: =F78+G78+H78+I78+J78+K78+L78+M78+N78+O78+P78+Q78+R78+S78+T78 -> 177
C79: LICENCIADO EN PEDAGOGÍA | D79: =U79+U80 -> 733 | E79: Hombre | F79: 0 | G79: 0 | H79: 5 | I79: 23 | J79: 31 | K79: 21 | L79: 17 | M79: 18 | N79: 9 | O79: 8 | P79: 2 | Q79: 3 | R79: 9 | S79: 3 | T79: 3 | U79: =F79+G79+H79+I79+J79+K79+L79+M79+N79+O79+P79+Q79+R79+S79+T79 -> 152
C80: LICENCIADO EN PEDAGOGÍA | E80: Mujer | F80: 0 | G80: 0 | H80: 50 | I80: 107 | J80: 111 | K80: 99 | L80: 61 | M80: 48 | N80: 28 | O80: 16 | P80: 13 | Q80: 13 | R80: 20 | S80: 7 | T80: 8 | U80: =F80+G80+H80+I80+J80+K80+L80+M80+N80+O80+P80+Q80+R80+S80+T80 -> 581
C81: LICENCIADO EN PSICOPEDAGOGÍA | D81: =U81+U82 -> 579 | E81: Hombre | F81: 0 | G81: 0 | H81: 0 | I81: 13 | J81: 25 | K81: 28 | L81: 12 | M81: 13 | N81: 15 | O81: 4 | P81: 3 | Q81: 2 | R81: 19 | S81: 10 | T81: 4 | U81: =F81+G81+H81+I81+J81+K81+L81+M81+N81+O81+P81+Q81+R81+S81+T81 -> 148
C82: LICENCIADO EN PSICOPEDAGOGÍA | E82: Mujer | F82: 0 | G82: 0 | H82: 1 | I82: 56 | J82: 81 | K82: 67 | L82: 43 | M82: 33 | N82: 30 | O82: 11 | P82: 22 | Q82: 13 | R82: 43 | S82: 16 | T82: 15 | U82: =F82+G82+H82+I82+J82+K82+L82+M82+N82+O82+P82+Q82+R82+S82+T82 -> 431
C83: MAESTRO ESPECIALIDAD DE AUDICIÓN Y LENGUAJE | D83: =U83+U84 -> 121 | E83: Hombre | F83: 0 | G83: 0 | H83: 0 | I83: 0 | J83: 0 | K83: 2 | L83: 1 | M83: 3 | N83: 1 | O83: 0 | P83: 1 | Q83: 0 | R83: 2 | S83: 2 | T83: 2 | U83: =F83+G83+H83+I83+J83+K83+L83+M83+N83+O83+P83+Q83+R83+S83+T83 -> 14
C84: MAESTRO ESPECIALIDAD DE AUDICIÓN Y LENGUAJE | E84: Mujer | F84: 0 | G84: 0 | H84: 14 | I84: 15 | J84: 13 | K84: 15 | L84: 7 | M84: 5 | N84: 7 | O84: 5 | P84: 4 | Q84: 3 | R84: 13 | S84: 4 | T84: 2 | U84: =F84+G84+H84+I84+J84+K84+L84+M84+N84+O84+P84+Q84+R84+S84+T84 -> 107
C85: MAESTRO ESPECIALIDAD DE EDUCACIÓN ESPECIAL | D85: =U85+U86 -> 124 | E85: Hombre | F85: 0 | G85: 0 | H85: 0 | I85: 4 | J85: 1 | K85: 4 | L85: 2 | M85: 4 | N85: 1 | O85: 0 | P85: 1 | Q85: 1 | R85: 1 | S85: 0 | T85: 4 | U85: =F85+G85+H85+I85+J85+K85+L85+M85+N85+O85+P85+Q85+R85+S85+T85 -> 23
C86: MAESTRO ESPECIALIDAD DE EDUCACIÓN ESPECIAL | E86: Mujer | F86: 0 | G86: 0 | H86: 22 | I86: 17 | J86: 11 | K86: 12 | L86: 10 | M86: 5 | N86: 4 | O86: 4 | P86: 3 | Q86: 1 | R86: 6 | S86: 5 | T86: 1 | U86: =F86+G86+H86+I86+J86+K86+L86+M86+N86+O86+P86+Q86+R86+S86+T86 -> 101
C87: MAESTRO ESPECIALIDAD DE EDUCACIÓN FÍSICA | D87: =U87+U88 -> 235 | E87: Hombre | F87: 0 | G87: 1 | H87: 38 | I87: 18 | J87: 12 | K87: 15 | L87: 18 | M87: 12 | N87: 7 | O87: 9 | P87: 10 | Q87: 6 | R87: 10 | S87: 5 | T87: 5 | U87: =F87+G87+H87+I87+J87+K87+L87+M87+N87+O87+P87+Q87+R87+S87+T87 -> 166
C88: MAESTRO ESPECIALIDAD DE EDUCACIÓN FÍSICA | E88: Mujer | F88: 0 | G88: 0 | H88: 13 | I88: 7 | J88: 8 | K88: 8 | L88: 3 | M88: 8 | N88: 4 | O88: 6 | P88: 1 | Q88: 2 | R88: 6 | S88: 2 | T88: 1 | U88: =F88+G88+H88+I88+J88+K88+L88+M88+N88+O88+P88+Q88+R88+S88+T88 -> 69
C89: MAESTRO ESPECIALIDAD DE EDUCACIÓN INFANTIL | D89: =U89+U90 -> 263 | E89: Hombre | F89: 0 | G89: 0 | H89: 2 | I89: 0 | J89: 2 | K89: 1 | L89: 0 | M89: 1 | N89: 0 | O89: 2 | P89: 1 | Q89: 0 | R89: 2 | S89: 1 | T89: 0 | U89: =F89+G89+H89+I89+J89+K89+L89+M89+N89+O89+P89+Q89+R89+S89+T89 -> 12
C90: MAESTRO ESPECIALIDAD DE EDUCACIÓN INFANTIL | E90: Mujer | F90: 0 | G90: 0 | H90: 74 | I90: 27 | J90: 26 | K90: 24 | L90: 16 | M90: 11 | N90: 11 | O90: 11 | P90: 6 | Q90: 9 | R90: 20 | S90: 7 | T90: 9 | U90: =F90+G90+H90+I90+J90+K90+L90+M90+N90+O90+P90+Q90+R90+S90+T90 -> 251
C91: MAESTRO ESPECIALIDAD DE EDUCACIÓN MUSICAL | D91: =U91+U92 -> 190 | E91: Hombre | F91: 0 | G91: 0 | H91: 11 | I91: 17 | J91: 11 | K91: 9 | L91: 6 | M91: 6 | N91: 10 | O91: 3 | P91: 6 | Q91: 3 | R91: 8 | S91: 5 | T91: 2 | U91: =F91+G91+H91+I91+J91+K91+L91+M91+N91+O91+P91+Q91+R91+S91+T91 -> 97
C92: MAESTRO ESPECIALIDAD DE EDUCACIÓN MUSICAL | E92: Mujer | F92: 0 | G92: 0 | H92: 15 | I92: 15 | J92: 21 | K92: 6 | L92: 6 | M92: 3 | N92: 5 | O92: 5 | P92: 5 | Q92: 1 | R92: 7 | S92: 3 | T92: 1 | U92: =F92+G92+H92+I92+J92+K92+L92+M92+N92+O92+P92+Q92+R92+S92+T92 -> 93
C93: MAESTRO ESPECIALIDAD DE EDUCACIÓN PRIMARIA | D93: =U93+U94 -> 458 | E93: Hombre | F93: 0 | G93: 0 | H93: 21 | I93: 8 | J93: 24 | K93: 13 | L93: 9 | M93: 10 | N93: 2 | O93: 5 | P93: 2 | Q93: 7 | R93: 19 | S93: 5 | T93: 1 | U93: =F93+G93+H93+I93+J93+K93+L93+M93+N93+O93+P93+Q93+R93+S93+T93 -> 126
C94: MAESTRO ESPECIALIDAD DE EDUCACIÓN PRIMARIA | E94: Mujer | F94: 0 | G94: 0 | H94: 88 | I94: 44 | J94: 33 | K94: 25 | L94: 31 | M94: 26 | N94: 15 | O94: 14 | P94: 8 | Q94: 10 | R94: 24 | S94: 8 | T94: 6 | U94: =F94+G94+H94+I94+J94+K94+L94+M94+N94+O94+P94+Q94+R94+S94+T94 -> 332
C95: MAESTRO ESPECIALIDAD DE LENGUA EXTRANJERA | D95: =U95+U96 -> 303 | E95: Hombre | F95: 0 | G95: 1 | H95: 7 | I95: 6 | J95: 5 | K95: 10 | L95: 6 | M95: 6 | N95: 6 | O95: 6 | P95: 6 | Q95: 5 | R95: 11 | S95: 5 | T95: 1 | U95: =F95+G95+H95+I95+J95+K95+L95+M95+N95+O95+P95+Q95+R95+S95+T95 -> 81
C96: MAESTRO ESPECIALIDAD DE LENGUA EXTRANJERA | E96: Mujer | F96: 0 | G96: 1 | H96: 40 | I96: 30 | J96: 34 | K96: 23 | L96: 19 | M96: 10 | N96: 8 | O96: 6 | P96: 9 | Q96: 4 | R96: 17 | S96: 11 | T96: 10 | U96: =F96+G96+H96+I96+J96+K96+L96+M96+N96+O96+P96+Q96+R96+S96+T96 -> 222
A97: FAC. CC. ECONOMICAS EMPRESAR. | B97: =D97+D99+D101+D103+D105+D107+D109+D111+D113+D115 -> 6354 | C97: DIPLOMADO EN CIENCIAS EMPRESARIALES | D97: =U97+U98 -> 1007 | E97: Hombre | F97: 0 | G97: 6 | H97: 35 | I97: 66 | J97: 58 | K97: 52 | L97: 42 | M97: 50 | N97: 35 | O97: 38 | P97: 18 | Q97: 17 | R97: 46 | S97: 14 | T97: 12 | U97: =F97+G97+H97+I97+J97+K97+L97+M97+N97+O97+P97+Q97+R97+S97+T97 -> 489
C98: DIPLOMADO EN CIENCIAS EMPRESARIALES | E98: Mujer | F98: 0 | G98: 0 | H98: 52 | I98: 82 | J98: 61 | K98: 54 | L98: 48 | M98: 41 | N98: 33 | O98: 27 | P98: 21 | Q98: 21 | R98: 46 | S98: 17 | T98: 15 | U98: =F98+G98+H98+I98+J98+K98+L98+M98+N98+O98+P98+Q98+R98+S98+T98 -> 518
C99: DIPLOMADO EN TURISMO | D99: =U99+U100 -> 413 | E99: Hombre | F99: 0 | G99: 0 | H99: 12 | I99: 29 | J99: 19 | K99: 15 | L99: 12 | M99: 4 | N99: 13 | O99: 4 | P99: 3 | Q99: 1 | R99: 5 | S99: 1 | T99: 1 | U99: =F99+G99+H99+I99+J99+K99+L99+M99+N99+O99+P99+Q99+R99+S99+T99 -> 119
C100: DIPLOMADO EN TURISMO | E100: Mujer | F100: 0 | G100: 0 | H100: 36 | I100: 65 | J100: 52 | K100: 31 | L100: 28 | M100: 21 | N100: 9 | O100: 13 | P100: 14 | Q100: 7 | R100: 14 | S100: 4 | T100: 0 | U100: =F100+G100+H100+I100+J100+K100+L100+M100+N100+O100+P100+Q100+R100+S100+T100 -> 294
C101: GRADO EN ADMINISTRACIÓN Y DIRECCIÓN DE EMPRESAS | D101: =U101+U102 -> 620 | E101: Hombre | F101: 88 | G101: 70 | H101: 50 | I101: 33 | J101: 14 | K101: 9 | L101: 4 | M101: 2 | N101: 3 | O101: 3 | P101: 0 | Q101: 3 | R101: 3 | S101: 1 | T101: 4 | U101: =F101+G101+H101+I101+J101+K101+L101+M101+N101+O101+P101+Q101+R101+S101+T101 -> 287
C102: GRADO EN ADMINISTRACIÓN Y DIRECCIÓN DE EMPRESAS | E102: Mujer | F102: 113 | G102: 138 | H102: 29 | I102: 17 | J102: 15 | K102: 8 | L102: 2 | M102: 3 | N102: 1 | O102: 0 | P102: 0 | Q102: 2 | R102: 1 | S102: 1 | T102: 3 | U102: =F102+G102+H102+I102+J102+K102+L102+M102+N102+O102+P102+Q102+R102+S102+T102 -> 333
C103: GRADO EN ECONOMÍA | D103: =U103+U104 -> 521 | E103: Hombre | F103: 37 | G103: 96 | H103: 59 | I103: 26 | J103: 17 | K103: 7 | L103: 6 | M103: 8 | N103: 3 | O103: 1 | P103: 0 | Q103: 1 | R103: 0 | S103: 1 | T103: 2 | U103: =F103+G103+H103+I103+J103+K103+L103+M103+N103+O103+P103+Q103+R103+S103+T103 -> 264
C104: GRADO EN ECONOMÍA | E104: Mujer | F104: 86 | G104: 93 | H104: 33 | I104: 20 | J104: 11 | K104: 9 | L104: 2 | M104: 0 | N104: 0 | O104: 2 | P104: 0 | Q104: 0 | R104: 1 | S104: 0 | T104: 0 | U104: =F104+G104+H104+I104+J104+K104+L104+M104+N104+O104+P104+Q104+R104+S104+T104 -> 257
C105: GRADO EN FINANZAS Y CONTABILIDAD | D105: =U105+U106 -> 263 | E105: Hombre | F105: 10 | G105: 22 | H105: 23 | I105: 12 | J105: 9 | K105: 10 | L105: 7 | M105: 6 | N105: 2 | O105: 2 | P105: 1 | Q105: 1 | R105: 1 | S105: 1 | T105: 3 | U105: =F105+G105+H105+I105+J105+K105+L105+M105+N105+O105+P105+Q105+R105+S105+T105 -> 110
C106: GRADO EN FINANZAS Y CONTABILIDAD | E106: Mujer | F106: 22 | G106: 39 | H106: 27 | I106: 14 | J106: 18 | K106: 8 | L106: 11 | M106: 4 | N106: 6 | O106: 3 | P106: 0 | Q106: 0 | R106: 0 | S106: 1 | T106: 0 | U106: =F106+G106+H106+I106+J106+K106+L106+M106+N106+O106+P106+Q106+R106+S106+T106 -> 153
C107: GRADO EN MARKETING E INVESTIGACIÓN DE MERCADOS | D107: =U107+U108 -> 255 | E107: Hombre | F107: 19 | G107: 47 | H107: 16 | I107: 15 | J107: 9 | K107: 10 | L107: 3 | M107: 0 | N107: 1 | O107: 3 | P107: 0 | Q107: 1 | R107: 0 | S107: 0 | T107: 3 | U107: =F107+G107+H107+I107+J107+K107+L107+M107+N107+O107+P107+Q107+R107+S107+T107 -> 127
C108: GRADO EN MARKETING E INVESTIGACIÓN DE MERCADOS | E108: Mujer | F108: 42 | G108: 45 | H108: 14 | I108: 9 | J108: 3 | K108: 2 | L108: 5 | M108: 3 | N108: 1 | O108: 2 | P108: 0 | Q108: 0 | R108: 0 | S108: 1 | T108: 1 | U108: =F108+G108+H108+I108+J108+K108+L108+M108+N108+O108+P108+Q108+R108+S108+T108 -> 128
C109: GRADO EN TURISMO | D109: =U109+U110 -> 286 | E109: Hombre | F109: 15 | G109: 24 | H109: 11 | I109: 14 | J109: 11 | K109: 9 | L109: 4 | M109: 1 | N109: 1 | O109: 5 | P109: 2 | Q109: 0 | R109: 3 | S109: 1 | T109: 1 | U109: =F109+G109+H109+I109+J109+K109+L109+M109+N109+O109+P109+Q109+R109+S109+T109 -> 102
C110: GRADO EN TURISMO | E110: Mujer | F110: 39 | G110: 62 | H110: 30 | I110: 15 | J110: 8 | K110: 13 | L110: 5 | M110: 5 | N110: 1 | O110: 1 | P110: 2 | Q110: 0 | R110: 2 | S110: 0 | T110: 1 | U110: =F110+G110+H110+I110+J110+K110+L110+M110+N110+O110+P110+Q110+R110+S110+T110 -> 184
C111: LICENCIADO EN ADMINISTRACIÓN Y DIRECCIÓN DE EMPRESAS | D111: =U111+U112 -> 1694 | E111: Hombre | F111: 0 | G111: 4 | H111: 74 | I111: 138 | J111: 142 | K111: 106 | L111: 84 | M111: 64 | N111: 41 | O111: 21 | P111: 16 | Q111: 11 | R111: 46 | S111: 8 | T111: 9 | U111: =F111+G111+H111+I111+J111+K111+L111+M111+N111+O111+P111+Q111+R111+S111+T111 -> 764
C112: LICENCIADO EN ADMINISTRACIÓN Y DIRECCIÓN DE EMPRESAS | E112: Mujer | F112: 0 | G112: 0 | H112: 125 | I112: 161 | J112: 173 | K112: 151 | L112: 99 | M112: 63 | N112: 35 | O112: 24 | P112: 18 | Q112: 16 | R112: 44 | S112: 6 | T112: 15 | U112: =F112+G112+H112+I112+J112+K112+L112+M112+N112+O112+P112+Q112+R112+S112+T112 -> 930
C113: LICENCIADO EN ECONOMÍA | D113: =U113+U114 -> 1143 | E113: Hombre | F113: 0 | G113: 0 | H113: 38 | I113: 74 | J113: 88 | K113: 85 | L113: 79 | M113: 74 | N113: 35 | O113: 34 | P113: 24 | Q113: 20 | R113: 40 | S113: 8 | T113: 2 | U113: =F113+G113+H113+I113+J113+K113+L113+M113+N113+O113+P113+Q113+R113+S113+T113 -> 601
C114: LICENCIADO EN ECONOMÍA | E114: Mujer | F114: 0 | G114: 1 | H114: 55 | I114: 85 | J114: 88 | K114: 80 | L114: 61 | M114: 46 | N114: 29 | O114: 31 | P114: 27 | Q114: 6 | R114: 31 | S114: 0 | T114: 2 | U114: =F114+G114+H114+I114+J114+K114+L114+M114+N114+O114+P114+Q114+R114+S114+T114 -> 542
C115: LICENCIADO EN INVESTIGACIÓN Y TÉCNICAS DE MERCADO | D115: =U115+U116 -> 152 | E115: Hombre | F115: 0 | G115: 1 | H115: 5 | I115: 3 | J115: 6 | K115: 11 | L115: 14 | M115: 11 | N115: 8 | O115: 6 | P115: 5 | Q115: 6 | R115: 6 | S115: 3 | T115: 1 | U115: =F115+G115+H115+I115+J115+K115+L115+M115+N115+O115+P115+Q115+R115+S115+T115 -> 86
C116: LICENCIADO EN INVESTIGACIÓN Y TÉCNICAS DE MERCADO | E116: Mujer | F116: 0 | G116: 0 | H116: 0 | I116: 0 | J116: 1 | K116: 11 | L116: 13 | M116: 12 | N116: 7 | O116: 6 | P116: 4 | Q116: 4 | R116: 6 | S116: 2 | T116: 0 | U116: =F116+G116+H116+I116+J116+K116+L116+M116+N116+O116+P116+Q116+R116+S116+T116 -> 66
A117: FAC. CC. POLÍTICAS SOCIOLOGÍA | B117: =D117+D119+D121+D123 -> 1418 | C117: GRADO EN CIENCIAS POLÍTICAS Y DE LA ADMINISTRACIÓN | D117: =U117+U118 -> 303 | E117: Hombre | F117: 32 | G117: 35 | H117: 29 | I117: 24 | J117: 21 | K117: 13 | L117: 10 | M117: 5 | N117: 5 | O117: 0 | P117: 0 | Q117: 2 | R117: 5 | S117: 1 | T117: 12 | U117: =F117+G117+H117+I117+J117+K117+L117+M117+N117+O117+P117+Q117+R117+S117+T117 -> 194
C118: GRADO EN CIENCIAS POLÍTICAS Y DE LA ADMINISTRACIÓN | E118: Mujer | F118: 23 | G118: 47 | H118: 16 | I118: 7 | J118: 5 | K118: 2 | L118: 1 | M118: 1 | N118: 0 | O118: 0 | P118: 0 | Q118: 0 | R118: 0 | S118: 1 | T118: 6 | U118: =F118+G118+H118+I118+J118+K118+L118+M118+N118+O118+P118+Q118+R118+S118+T118 -> 109
C119: GRADO EN SOCIOLOGÍA | D119: =U119+U120 -> 255 | E119: Hombre | F119: 11 | G119: 24 | H119: 21 | I119: 13 | J119: 11 | K119: 3 | L119: 6 | M119: 2 | N119: 3 | O119: 2 | P119: 0 | Q119: 0 | R119: 1 | S119: 1 | T119: 3 | U119: =F119+G119+H119+I119+J119+K119+L119+M119+N119+O119+P119+Q119+R119+S119+T119 -> 101
C120: GRADO EN SOCIOLOGÍA | E120: Mujer | F120: 34 | G120: 50 | H120: 31 | I120: 12 | J120: 9 | K120: 6 | L120: 2 | M120: 1 | N120: 2 | O120: 0 | P120: 0 | Q120: 0 | R120: 1 | S120: 0 | T120: 6 | U120: =F120+G120+H120+I120+J120+K120+L120+M120+N120+O120+P120+Q120+R120+S120+T120 -> 154
C121: LICENCIADO EN CIENCIAS POLÍTICAS Y DE LA ADMINISTRACIÓN | D121: =U121+U122 -> 479 | E121: Hombre | F121: 0 | G121: 5 | H121: 47 | I121: 58 | J121: 66 | K121: 45 | L121: 26 | M121: 15 | N121: 10 | O121: 11 | P121: 2 | Q121: 4 | R121: 24 | S121: 14 | T121: 11 | U121: =F121+G121+H121+I121+J121+K121+L121+M121+N121+O121+P121+Q121+R121+S121+T121 -> 338
C122: LICENCIADO EN CIENCIAS POLÍTICAS Y DE LA ADMINISTRACIÓN | E122: Mujer | F122: 0 | G122: 0 | H122: 6 | I122: 15 | J122: 25 | K122: 18 | L122: 13 | M122: 11 | N122: 12 | O122: 6 | P122: 2 | Q122: 4 | R122: 13 | S122: 10 | T122: 6 | U122: =F122+G122+H122+I122+J122+K122+L122+M122+N122+O122+P122+Q122+R122+S122+T122 -> 141
C123: LICENCIADO EN SOCIOLOGÍA | D123: =U123+U124 -> 381 | E123: Hombre | F123: 1 | G123: 1 | H123: 23 | I123: 34 | J123: 25 | K123: 24 | L123: 24 | M123: 21 | N123: 12 | O123: 5 | P123: 4 | Q123: 1 | R123: 11 | S123: 2 | T123: 5 | U123: =F123+G123+H123+I123+J123+K123+L123+M123+N123+O123+P123+Q123+R123+S123+T123 -> 193
C124: LICENCIADO EN SOCIOLOGÍA | E124: Mujer | F124: 0 | G124: 0 | H124: 17 | I124: 15 | J124: 33 | K124: 26 | L124: 16 | M124: 25 | N124: 16 | O124: 10 | P124: 5 | Q124: 4 | R124: 9 | S124: 7 | T124: 5 | U124: =F124+G124+H124+I124+J124+K124+L124+M124+N124+O124+P124+Q124+R124+S124+T124 -> 188
A125: FAC. DERECHO | B125: =D125+D127+D129 -> 3344 | C125: GRADO EN DERECHO | D125: =U125+U126 -> 1044 | E125: Hombre | F125: 107 | G125: 172 | H125: 53 | I125: 43 | J125: 18 | K125: 17 | L125: 6 | M125: 9 | N125: 11 | O125: 1 | P125: 3 | Q125: 1 | R125: 7 | S125: 4 | T125: 22 | U125: =F125+G125+H125+I125+J125+K125+L125+M125+N125+O125+P125+Q125+R125+S125+T125 -> 474
C126: GRADO EN DERECHO | E126: Mujer | F126: 185 | G126: 234 | H126: 68 | I126: 24 | J126: 15 | K126: 9 | L126: 2 | M126: 2 | N126: 4 | O126: 3 | P126: 3 | Q126: 1 | R126: 7 | S126: 2 | T126: 11 | U126: =F126+G126+H126+I126+J126+K126+L126+M126+N126+O126+P126+Q126+R126+S126+T126 -> 570
C127: LICENCIADO EN DERECHO | D127: =U127+U128 -> 2299 | E127: Hombre | F127: 0 | G127: 1 | H127: 111 | I127: 153 | J127: 196 | K127: 144 | L127: 109 | M127: 58 | N127: 54 | O127: 33 | P127: 17 | Q127: 16 | R127: 64 | S127: 36 | T127: 77 | U127: =F127+G127+H127+I127+J127+K127+L127+M127+N127+O127+P127+Q127+R127+S127+T127 -> 1069
C128: LICENCIADO EN DERECHO | E128: Mujer | F128: 0 | G128: 0 | H128: 177 | I128: 182 | J128: 211 | K128: 145 | L128: 102 | M128: 67 | N128: 62 | O128: 33 | P128: 29 | Q128: 24 | R128: 63 | S128: 49 | T128: 86 | U128: =F128+G128+H128+I128+J128+K128+L128+M128+N128+O128+P128+Q128+R128+S128+T128 -> 1230
C129: LICENCIATURA EN DERECHO | D129: =U129+U130 -> 1 | E129: Hombre | F129: 0 | G129: 0 | H129: 0 | I129: 0 | J129: 0 | K129: 0 | L129: 0 | M129: 0 | N129: 0 | O129: 0 | P129: 0 | Q129: 0 | R129: 0 | S129: 0 | T129: 0 | U129: =F129+G129+H129+I129+J129+K129+L129+M129+N129+O129+P129+Q129+R129+S129+T129 -> 0
C130: LICENCIATURA EN DERECHO | E130: Mujer | F130: 0 | G130: 0 | H130: 0 | I130: 0 | J130: 0 | K130: 0 | L130: 0 | M130: 0 | N130: 0 | O130: 0 | P130: 0 | Q130: 0 | R130: 1 | S130: 0 | T130: 0 | U130: =F130+G130+H130+I130+J130+K130+L130+M130+N130+O130+P130+Q130+R130+S130+T130 -> 1
A131: FAC. FARMACIA | B131: =D131+D133+D135+D137+D139+D141 -> 3250 | C131: DIPLOMADO EN NUTRICIÓN HUMANA Y DIETÉTICA | D131: =U131+U132 -> 180 | E131: Hombre | F131: 0 | G131: 0 | H131: 8 | I131: 5 | J131: 6 | K131: 0 | L131: 2 | M131: 5 | N131: 4 | O131: 5 | P131: 0 | Q131: 3 | R131: 2 | S131: 2 | T131: 3 | U131: =F131+G131+H131+I131+J131+K131+L131+M131+N131+O131+P131+Q131+R131+S131+T131 -> 45
C132: DIPLOMADO EN NUTRICIÓN HUMANA Y DIETÉTICA | E132: Mujer | F132: 0 | G132: 0 | H132: 26 | I132: 12 | J132: 17 | K132: 16 | L132: 14 | M132: 8 | N132: 12 | O132: 10 | P132: 3 | Q132: 0 | R132: 12 | S132: 1 | T132: 4 | U132: =F132+G132+H132+I132+J132+K132+L132+M132+N132+O132+P132+Q132+R132+S132+T132 -> 135
C133: GRADO EN CIENCIA Y TECNOLOGÍA DE LOS ALIMENTOS | D133: =U133+U134 -> 63 | E133: Hombre | F133: 7 | G133: 3 | H133: 0 | I133: 3 | J133: 3 | K133: 0 | L133: 0 | M133: 1 | N133: 0 | O133: 0 | P133: 0 | Q133: 0 | R133: 0 | S133: 2 | T133: 1 | U133: =F133+G133+H133+I133+J133+K133+L133+M133+N133+O133+P133+Q133+R133+S133+T133 -> 20
C134: GRADO EN CIENCIA Y TECNOLOGÍA DE LOS ALIMENTOS | E134: Mujer | F134: 19 | G134: 6 | H134: 4 | I134: 4 | J134: 2 | K134: 1 | L134: 1 | M134: 1 | N134: 0 | O134: 2 | P134: 0 | Q134: 1 | R134: 2 | S134: 0 | T134: 0 | U134: =F134+G134+H134+I134+J134+K134+L134+M134+N134+O134+P134+Q134+R134+S134+T134 -> 43
C135: GRADO EN FARMACIA | D135: =U135+U136 -> 683 | E135: Hombre | F135: 67 | G135: 59 | H135: 22 | I135: 11 | J135: 7 | K135: 5 | L135: 2 | M135: 5 | N135: 1 | O135: 2 | P135: 1 | Q135: 2 | R135: 5 | S135: 1 | T135: 5 | U135: =F135+G135+H135+I135+J135+K135+L135+M135+N135+O135+P135+Q135+R135+S135+T135 -> 195
C136: GRADO EN FARMACIA | E136: Mujer | F136: 180 | G136: 175 | H136: 56 | I136: 25 | J136: 13 | K136: 12 | L136: 5 | M136: 2 | N136: 6 | O136: 1 | P136: 3 | Q136: 2 | R136: 5 | S136: 0 | T136: 3 | U136: =F136+G136+H136+I136+J136+K136+L136+M136+N136+O136+P136+Q136+R136+S136+T136 -> 488
C137: GRADO EN NUTRICIÓN HUMANA Y DIETÉTICA | D137: =U137+U138 -> 195 | E137: Hombre | F137: 9 | G137: 9 | H137: 1 | I137: 6 | J137: 3 | K137: 3 | L137: 4 | M137: 2 | N137: 3 | O137: 1 | P137: 1 | Q137: 0 | R137: 0 | S137: 1 | T137: 3 | U137: =F137+G137+H137+I137+J137+K137+L137+M137+N137+O137+P137+Q137+R137+S137+T137 -> 46
C138: GRADO EN NUTRICIÓN HUMANA Y DIETÉTICA | E138: Mujer | F138: 51 | G138: 46 | H138: 11 | I138: 8 | J138: 6 | K138: 8 | L138: 1 | M138: 5 | N138: 1 | O138: 1 | P138: 1 | Q138: 1 | R138: 5 | S138: 1 | T138: 3 | U138: =F138+G138+H138+I138+J138+K138+L138+M138+N138+O138+P138+Q138+R138+S138+T138 -> 149
C139: LICENCIADO EN CIENCIA Y TECNOLOGÍA DE LOS ALIMENTOS | D139: =U139+U140 -> 222 | E139: Hombre | F139: 0 | G139: 0 | H139: 0 | I139: 7 | J139: 5 | K139: 8 | L139: 2 | M139: 3 | N139: 4 | O139: 2 | P139: 1 | Q139: 2 | R139: 6 | S139: 5 | T139: 3 | U139: =F139+G139+H139+I139+J139+K139+L139+M139+N139+O139+P139+Q139+R139+S139+T139 -> 48
C140: LICENCIADO EN CIENCIA Y TECNOLOGÍA DE LOS ALIMENTOS | E140: Mujer | F140: 0 | G140: 0 | H140: 0 | I140: 22 | J140: 32 | K140: 27 | L140: 26 | M140: 7 | N140: 8 | O140: 6 | P140: 5 | Q140: 3 | R140: 23 | S140: 9 | T140: 6 | U140: =F140+G140+H140+I140+J140+K140+L140+M140+N140+O140+P140+Q140+R140+S140+T140 -> 174
C141: LICENCIADO EN FARMACIA | D141: =U141+U142 -> 1907 | E141: Hombre | F141: 0 | G141: 0 | H141: 49 | I141: 86 | J141: 94 | K141: 67 | L141: 71 | M141: 47 | N141: 34 | O141: 27 | P141: 20 | Q141: 22 | R141: 67 | S141: 31 | T141: 25 | U141: =F141+G141+H141+I141+J141+K141+L141+M141+N141+O141+P141+Q141+R141+S141+T141 -> 640
C142: LICENCIADO EN FARMACIA | E142: Mujer | F142: 0 | G142: 1 | H142: 135 | I142: 148 | J142: 176 | K142: 168 | L142: 139 | M142: 94 | N142: 75 | O142: 65 | P142: 44 | Q142: 44 | R142: 106 | S142: 37 | T142: 35 | U142: =F142+G142+H142+I142+J142+K142+L142+M142+N142+O142+P142+Q142+R142+S142+T142 -> 1267
A143: FAC. FILOSOFIA Y LETRAS | B143: =D143+D145+D147+D149+D151+D153+D155+D157+D159+D161+D163+D165+D167+D169+D171+D173+D175+D177+D179+D181+D183+D185+D187+D189+D191+D193+D195+D197+D199+D201 -> 4944 | C143: GRADO EN ANTROPOLOGÍA SOCIAL Y CULTURAL | D143: =U143+U144 -> 70 | E143: Hombre | F143: 2 | G143: 5 | H143: 6 | I143: 7 | J143: 3 | K143: 1 | L143: 2 | M143: 2 | N143: 2 | O143: 1 | P143: 0 | Q143: 0 | R143: 2 | S143: 1 | T143: 2 | U143: =F143+G143+H143+I143+J143+K143+L143+M143+N143+O143+P143+Q143+R143+S143+T143 -> 36
C144: GRADO EN ANTROPOLOGÍA SOCIAL Y CULTURAL | E144: Mujer | F144: 10 | G144: 6 | H144: 5 | I144: 4 | J144: 4 | K144: 1 | L144: 0 | M144: 0 | N144: 0 | O144: 0 | P144: 1 | Q144: 0 | R144: 1 | S144: 1 | T144: 1 | U144: =F144+G144+H144+I144+J144+K144+L144+M144+N144+O144+P144+Q144+R144+S144+T144 -> 34
C145: GRADO EN ESTUDIOS FRANCESES | D145: =U145+U146 -> 131 | E145: Hombre | F145: 3 | G145: 5 | H145: 8 | I145: 10 | J145: 1 | K145: 1 | L145: 1 | M145: 0 | N145: 0 | O145: 0 | P145: 0 | Q145: 0 | R145: 1 | S145: 0 | T145: 0 | U145: =F145+G145+H145+I145+J145+K145+L145+M145+N145+O145+P145+Q145+R145+S145+T145 -> 30
C146: GRADO EN ESTUDIOS FRANCESES | E146: Mujer | F146: 40 | G146: 24 | H146: 17 | I146: 7 | J146: 1 | K146: 1 | L146: 2 | M146: 0 | N146: 2 | O146: 1 | P146: 0 | Q146: 1 | R146: 2 | S146: 1 | T146: 2 | U146: =F146+G146+H146+I146+J146+K146+L146+M146+N146+O146+P146+Q146+R146+S146+T146 -> 101
C147: GRADO EN ESTUDIOS INGLESES | D147: =U147+U148 -> 287 | E147: Hombre | F147: 19 | G147: 43 | H147: 12 | I147: 4 | J147: 6 | K147: 5 | L147: 1 | M147: 0 | N147: 0 | O147: 0 | P147: 1 | Q147: 0 | R147: 2 | S147: 1 | T147: 1 | U147: =F147+G147+H147+I147+J147+K147+L147+M147+N147+O147+P147+Q147+R147+S147+T147 -> 95
C148: GRADO EN ESTUDIOS INGLESES | E148: Mujer | F148: 66 | G148: 71 | H148: 24 | I148: 12 | J148: 8 | K148: 3 | L148: 2 | M148: 1 | N148: 1 | O148: 1 | P148: 0 | Q148: 1 | R148: 2 | S148: 0 | T148: 0 | U148: =F148+G148+H148+I148+J148+K148+L148+M148+N148+O148+P148+Q148+R148+S148+T148 -> 192
C149: GRADO EN ESTUDIOS ÁRABES E ISLÁMICOS | D149: =U149+U150 -> 65 | E149: Hombre | F149: 2 | G149: 2 | H149: 5 | I149: 1 | J149: 5 | K149: 1 | L149: 2 | M149: 1 | N149: 2 | O149: 2 | P149: 0 | Q149: 0 | R149: 3 | S149: 0 | T149: 1 | U149: =F149+G149+H149+I149+J149+K149+L149+M149+N149+O149+P149+Q149+R149+S149+T149 -> 27
C150: GRADO EN ESTUDIOS ÁRABES E ISLÁMICOS | E150: Mujer | F150: 7 | G150: 6 | H150: 6 | I150: 5 | J150: 3 | K150: 3 | L150: 2 | M150: 3 | N150: 0 | O150: 0 | P150: 1 | Q150: 1 | R150: 0 | S150: 0 | T150: 1 | U150: =F150+G150+H150+I150+J150+K150+L150+M150+N150+O150+P150+Q150+R150+S150+T150 -> 38
C151: GRADO EN FILOLOGÍA CLÁSICA | D151: =U151+U152 -> 69 | E151: Hombre | F151: 6 | G151: 8 | H151: 3 | I151: 4 | J151: 0 | K151: 2 | L151: 1 | M151: 0 | N151: 0 | O151: 0 | P151: 0 | Q151: 0 | R151: 0 | S151: 1 | T151: 0 | U151: =F151+G151+H151+I151+J151+K151+L151+M151+N151+O151+P151+Q151+R151+S151+T151 -> 25
C152: GRADO EN FILOLOGÍA CLÁSICA | E152: Mujer | F152: 19 | G152: 13 | H152: 6 | I152: 3 | J152: 1 | K152: 0 | L152: 0 | M152: 0 | N152: 0 | O152: 0 | P152: 0 | Q152: 0 | R152: 2 | S152: 0 | T152: 0 | U152: =F152+G152+H152+I152+J152+K152+L152+M152+N152+O152+P152+Q152+R152+S152+T152 -> 44
C153: GRADO EN FILOLOGÍA HISPÁNICA | D153: =U153+U154 -> 181 | E153: Hombre | F153: 8 | G153: 13 | H153: 23 | I153: 11 | J153: 10 | K153: 7 | L153: 6 | M153: 1 | N153: 1 | O153: 0 | P153: 0 | Q153: 0 | R153: 2 | S153: 1 | T153: 3 | U153: =F153+G153+H153+I153+J153+K153+L153+M153+N153+O153+P153+Q153+R153+S153+T153 -> 86
C154: GRADO EN FILOLOGÍA HISPÁNICA | E154: Mujer | F154: 34 | G154: 33 | H154: 11 | I154: 5 | J154: 2 | K154: 2 | L154: 4 | M154: 1 | N154: 0 | O154: 0 | P154: 0 | Q154: 1 | R154: 1 | S154: 1 | T154: 0 | U154: =F154+G154+H154+I154+J154+K154+L154+M154+N154+O154+P154+Q154+R154+S154+T154 -> 95
C155: GRADO EN FILOSOFÍA | D155: =U155+U156 -> 135 | E155: Hombre | F155: 15 | G155: 19 | H155: 13 | I155: 10 | J155: 9 | K155: 7 | L155: 2 | M155: 1 | N155: 1 | O155: 2 | P155: 1 | Q155: 1 | R155: 1 | S155: 0 | T155: 3 | U155: =F155+G155+H155+I155+J155+K155+L155+M155+N155+O155+P155+Q155+R155+S155+T155 -> 85
C156: GRADO EN FILOSOFÍA | E156: Mujer | F156: 12 | G156: 17 | H156: 6 | I156: 3 | J156: 4 | K156: 1 | L156: 2 | M156: 2 | N156: 1 | O156: 0 | P156: 0 | Q156: 0 | R156: 1 | S156: 0 | T156: 1 | U156: =F156+G156+H156+I156+J156+K156+L156+M156+N156+O156+P156+Q156+R156+S156+T156 -> 50
C157: GRADO EN GEOGRAFÍA Y GESTIÓN DEL TERRITORIO | D157: =U157+U158 -> 100 | E157: Hombre | F157: 12 | G157: 29 | H157: 7 | I157: 8 | J157: 5 | K157: 5 | L157: 2 | M157: 1 | N157: 1 | O157: 0 | P157: 0 | Q157: 0 | R157: 0 | S157: 0 | T157: 3 | U157: =F157+G157+H157+I157+J157+K157+L157+M157+N157+O157+P157+Q157+R157+S157+T157 -> 73
C158: GRADO EN GEOGRAFÍA Y GESTIÓN DEL TERRITORIO | E158: Mujer | F158: 9 | G158: 6 | H158: 6 | I158: 2 | J158: 1 | K158: 0 | L158: 1 | M158: 0 | N158: 0 | O158: 0 | P158: 0 | Q158: 0 | R158: 1 | S158: 0 | T158: 1 | U158: =F158+G158+H158+I158+J158+K158+L158+M158+N158+O158+P158+Q158+R158+S158+T158 -> 27
C159: GRADO EN HISTORIA | D159: =U159+U160 -> 285 | E159: Hombre | F159: 52 | G159: 56 | H159: 33 | I159: 18 | J159: 10 | K159: 9 | L159: 1 | M159: 1 | N159: 2 | O159: 3 | P159: 1 | Q159: 1 | R159: 4 | S159: 3 | T159: 10 | U159: =F159+G159+H159+I159+J159+K159+L159+M159+N159+O159+P159+Q159+R159+S159+T159 -> 204
C160: GRADO EN HISTORIA | E160: Mujer | F160: 19 | G160: 18 | H160: 14 | I160: 5 | J160: 6 | K160: 2 | L160: 3 | M160: 3 | N160: 1 | O160: 0 | P160: 0 | Q160: 1 | R160: 1 | S160: 0 | T160: 8 | U160: =F160+G160+H160+I160+J160+K160+L160+M160+N160+O160+P160+Q160+R160+S160+T160 -> 81
C161: GRADO EN HISTORIA DEL ARTE | D161: =U161+U162 -> 254 | E161: Hombre | F161: 10 | G161: 24 | H161: 13 | I161: 7 | J161: 8 | K161: 2 | L161: 3 | M161: 1 | N161: 4 | O161: 3 | P161: 0 | Q161: 1 | R161: 2 | S161: 0 | T161: 5 | U161: =F161+G161+H161+I161+J161+K161+L161+M161+N161+O161+P161+Q161+R161+S161+T161 -> 83
C162: GRADO EN HISTORIA DEL ARTE | E162: Mujer | F162: 40 | G162: 52 | H162: 27 | I162: 10 | J162: 6 | K162: 8 | L162: 2 | M162: 1 | N162: 5 | O162: 3 | P162: 0 | Q162: 2 | R162: 1 | S162: 2 | T162: 12 | U162: =F162+G162+H162+I162+J162+K162+L162+M162+N162+O162+P162+Q162+R162+S162+T162 -> 171
C163: GRADO EN HISTORIA Y CIENCIAS DE LA MÚSICA | D163: =U163+U164 -> 128 | E163: Hombre | F163: 11 | G163: 12 | H163: 11 | I163: 10 | J163: 5 | K163: 5 | L163: 1 | M163: 1 | N163: 4 | O163: 0 | P163: 1 | Q163: 1 | R163: 4 | S163: 1 | T163: 2 | U163: =F163+G163+H163+I163+J163+K163+L163+M163+N163+O163+P163+Q163+R163+S163+T163 -> 69
C164: GRADO EN HISTORIA Y CIENCIAS DE LA MÚSICA | E164: Mujer | F164: 14 | G164: 22 | H164: 6 | I164: 5 | J164: 5 | K164: 1 | L164: 2 | M164: 0 | N164: 1 | O164: 0 | P164: 0 | Q164: 0 | R164: 2 | S164: 1 | T164: 0 | U164: =F164+G164+H164+I164+J164+K164+L164+M164+N164+O164+P164+Q164+R164+S164+T164 -> 59
C165: GRADO EN LENGUAS MODERNAS Y SUS LITERATURAS | D165: =U165+U166 -> 152 | E165: Hombre | F165: 5 | G165: 5 | H165: 10 | I165: 16 | J165: 8 | K165: 5 | L165: 2 | M165: 2 | N165: 1 | O165: 1 | P165: 0 | Q165: 0 | R165: 1 | S165: 0 | T165: 1 | U165: =F165+G165+H165+I165+J165+K165+L165+M165+N165+O165+P165+Q165+R165+S165+T165 -> 57
C166: GRADO EN LENGUAS MODERNAS Y SUS LITERATURAS | E166: Mujer | F166: 32 | G166: 22 | H166: 10 | I166: 15 | J166: 2 | K166: 1 | L166: 2 | M166: 2 | N166: 4 | O166: 1 | P166: 0 | Q166: 0 | R166: 3 | S166: 1 | T166: 0 | U166: =F166+G166+H166+I166+J166+K166+L166+M166+N166+O166+P166+Q166+R166+S166+T166 -> 95
C167: GRADO EN LITERATURAS COMPARADAS | D167: =U167+U168 -> 58 | E167: Hombre | F167: 4 | G167: 3 | H167: 2 | I167: 4 | J167: 3 | K167: 1 | L167: 1 | M167: 1 | N167: 1 | O167: 1 | P167: 0 | Q167: 1 | R167: 0 | S167: 0 | T167: 0 | U167: =F167+G167+H167+I167+J167+K167+L167+M167+N167+O167+P167+Q167+R167+S167+T167 -> 22
C168: GRADO EN LITERATURAS COMPARADAS | E168: Mujer | F168: 9 | G168: 9 | H168: 6 | I168: 3 | J168: 4 | K168: 2 | L168: 0 | M168: 0 | N168: 0 | O168: 1 | P168: 0 | Q168: 1 | R168: 1 | S168: 0 | T168: 0 | U168: =F168+G168+H168+I168+J168+K168+L168+M168+N168+O168+P168+Q168+R168+S168+T168 -> 36
C169: LICENCIADO EN ANTROPOLOGÍA SOCIAL Y CULTURAL | D169: =U169+U170 -> 328 | E169: Hombre | F169: 0 | G169: 0 | H169: 15 | I169: 12 | J169: 9 | K169: 13 | L169: 9 | M169: 5 | N169: 10 | O169: 6 | P169: 3 | Q169: 5 | R169: 27 | S169: 9 | T169: 10 | U169: =F169+G169+H169+I169+J169+K169+L169+M169+N169+O169+P169+Q169+R169+S169+T169 -> 133
C170: LICENCIADO EN ANTROPOLOGÍA SOCIAL Y CULTURAL | E170: Mujer | F170: 0 | G170: 0 | H170: 0 | I170: 0 | J170: 19 | K170: 20 | L170: 27 | M170: 22 | N170: 16 | O170: 16 | P170: 11 | Q170: 5 | R170: 30 | S170: 9 | T170: 20 | U170: =F170+G170+H170+I170+J170+K170+L170+M170+N170+O170+P170+Q170+R170+S170+T170 -> 195
C171: LICENCIADO EN FILOLOGÍA CLÁSICA | D171: =U171+U172 -> 55 | E171: Hombre | F171: 0 | G171: 0 | H171: 4 | I171: 5 | J171: 4 | K171: 4 | L171: 3 | M171: 1 | N171: 2 | O171: 0 | P171: 0 | Q171: 0 | R171: 1 | S171: 0 | T171: 0 | U171: =F171+G171+H171+I171+J171+K171+L171+M171+N171+O171+P171+Q171+R171+S171+T171 -> 24
C172: LICENCIADO EN FILOLOGÍA CLÁSICA | E172: Mujer | F172: 0 | G172: 0 | H172: 2 | I172: 8 | J172: 5 | K172: 7 | L172: 4 | M172: 2 | N172: 0 | O172: 0 | P172: 1 | Q172: 1 | R172: 1 | S172: 0 | T172: 0 | U172: =F172+G172+H172+I172+J172+K172+L172+M172+N172+O172+P172+Q172+R172+S172+T172 -> 31
C173: LICENCIADO EN FILOLOGÍA ESLAVA | D173: =U173+U174 -> 33 | E173: Hombre | F173: 0 | G173: 0 | H173: 2 | I173: 3 | J173: 1 | K173: 2 | L173: 1 | M173: 0 | N173: 3 | O173: 1 | P173: 0 | Q173: 1 | R173: 1 | S173: 1 | T173: 3 | U173: =F173+G173+H173+I173+J173+K173+L173+M173+N173+O173+P173+Q173+R173+S173+T173 -> 19
C174: LICENCIADO EN FILOLOGÍA ESLAVA | E174: Mujer | F174: 0 | G174: 0 | H174: 0 | I174: 0 | J174: 4 | K174: 0 | L174: 1 | M174: 1 | N174: 1 | O174: 0 | P174: 1 | Q174: 1 | R174: 1 | S174: 1 | T174: 3 | U174: =F174+G174+H174+I174+J174+K174+L174+M174+N174+O174+P174+Q174+R174+S174+T174 -> 14
C175: LICENCIADO EN FILOLOGÍA FRANCESA | D175: =U175+U176 -> 100 | E175: Hombre | F175: 0 | G175: 0 | H175: 5 | I175: 10 | J175: 3 | K175: 3 | L175: 3 | M175: 2 | N175: 1 | O175: 1 | P175: 0 | Q175: 1 | R175: 3 | S175: 0 | T175: 1 | U175: =F175+G175+H175+I175+J175+K175+L175+M175+N175+O175+P175+Q175+R175+S175+T175 -> 33
C176: LICENCIADO EN FILOLOGÍA FRANCESA | E176: Mujer | F176: 0 | G176: 0 | H176: 9 | I176: 10 | J176: 11 | K176: 11 | L176: 3 | M176: 2 | N176: 6 | O176: 3 | P176: 0 | Q176: 2 | R176: 5 | S176: 3 | T176: 2 | U176: =F176+G176+H176+I176+J176+K176+L176+M176+N176+O176+P176+Q176+R176+S176+T176 -> 67
C177: LICENCIADO EN FILOLOGÍA HEBREA | D177: =U177+U178 -> 16 | E177: Hombre | F177: 0 | G177: 1 | H177: 9 | I177: 4 | J177: 0 | K177: 1 | L177: 0 | M177: 0 | N177: 0 | O177: 0 | P177: 0 | Q177: 0 | R177: 1 | S177: 0 | T177: 0 | U177: =F177+G177+H177+I177+J177+K177+L177+M177+N177+O177+P177+Q177+R177+S177+T177 -> 16
C178: LICENCIADO EN FILOLOGÍA HEBREA | E178: Mujer | F178: 0 | G178: 0 | H178: 0 | I178: 0 | J178: 0 | K178: 0 | L178: 0 | M178: 0 | N178: 0 | O178: 0 | P178: 0 | Q178: 0 | R178: 0 | S178: 0 | T178: 0 | U178: =F178+G178+H178+I178+J178+K178+L178+M178+N178+O178+P178+Q178+R178+S178+T178 -> 0
C179: LICENCIADO EN FILOLOGÍA HISPÁNICA | D179: =U179+U180 -> 533 | E179: Hombre | F179: 1 | G179: 5 | H179: 76 | I179: 84 | J179: 75 | K179: 34 | L179: 21 | M179: 12 | N179: 6 | O179: 5 | P179: 6 | Q179: 1 | R179: 6 | S179: 6 | T179: 5 | U179: =F179+G179+H179+I179+J179+K179+L179+M179+N179+O179+P179+Q179+R179+S179+T179 -> 343
C180: LICENCIADO EN FILOLOGÍA HISPÁNICA | E180: Mujer | F180: 0 | G180: 0 | H180: 29 | I180: 39 | J180: 29 | K180: 16 | L180: 12 | M180: 11 | N180: 12 | O180: 4 | P180: 5 | Q180: 7 | R180: 14 | S180: 7 | T180: 5 | U180: =F180+G180+H180+I180+J180+K180+L180+M180+N180+O180+P180+Q180+R180+S180+T180 -> 190
C181: LICENCIADO EN FILOLOGÍA INGLESA | D181: =U181+U182 -> 477 | E181: Hombre | F181: 0 | G181: 0 | H181: 23 | I181: 36 | J181: 22 | K181: 24 | L181: 14 | M181: 10 | N181: 7 | O181: 7 | P181: 4 | Q181: 5 | R181: 8 | S181: 3 | T181: 2 | U181: =F181+G181+H181+I181+J181+K181+L181+M181+N181+O181+P181+Q181+R181+S181+T181 -> 165
C182: LICENCIADO EN FILOLOGÍA INGLESA | E182: Mujer | F182: 0 | G182: 0 | H182: 49 | I182: 64 | J182: 58 | K182: 29 | L182: 35 | M182: 24 | N182: 14 | O182: 7 | P182: 6 | Q182: 4 | R182: 12 | S182: 2 | T182: 8 | U182: =F182+G182+H182+I182+J182+K182+L182+M182+N182+O182+P182+Q182+R182+S182+T182 -> 312
C183: LICENCIADO EN FILOLOGÍA ITALIANA | D183: =U183+U184 -> 10 | E183: Hombre | F183: 0 | G183: 0 | H183: 0 | I183: 0 | J183: 0 | K183: 0 | L183: 1 | M183: 1 | N183: 1 | O183: 1 | P183: 0 | Q183: 0 | R183: 0 | S183: 0 | T183: 0 | U183: =F183+G183+H183+I183+J183+K183+L183+M183+N183+O183+P183+Q183+R183+S183+T183 -> 4
C184: LICENCIADO EN FILOLOGÍA ITALIANA | E184: Mujer | F184: 0 | G184: 0 | H184: 0 | I184: 0 | J184: 0 | K184: 0 | L184: 0 | M184: 0 | N184: 1 | O184: 0 | P184: 0 | Q184: 0 | R184: 3 | S184: 0 | T184: 2 | U184: =F184+G184+H184+I184+J184+K184+L184+M184+N184+O184+P184+Q184+R184+S184+T184 -> 6
C185: LICENCIADO EN FILOLOGÍA PORTUGUESA | D185: =U185+U186 -> 1 | E185: Hombre | F185: 0 | G185: 0 | H185: 0 | I185: 0 | J185: 0 | K185: 0 | L185: 0 | M185: 0 | N185: 0 | O185: 0 | P185: 0 | Q185: 0 | R185: 1 | S185: 0 | T185: 0 | U185: =F185+G185+H185+I185+J185+K185+L185+M185+N185+O185+P185+Q185+R185+S185+T185 -> 1
C186: LICENCIADO EN FILOLOGÍA PORTUGUESA | E186: Mujer | F186: 0 | G186: 0 | H186: 0 | I186: 0 | J186: 0 | K186: 0 | L186: 0 | M186: 0 | N186: 0 | O186: 0 | P186: 0 | Q186: 0 | R186: 0 | S186: 0 | T186: 0 | U186: =F186+G186+H186+I186+J186+K186+L186+M186+N186+O186+P186+Q186+R186+S186+T186 -> 0
C187: LICENCIADO EN FILOLOGÍA ROMÁNICA | D187: =U187+U188 -> 12 | E187: Hombre | F187: 0 | G187: 0 | H187: 1 | I187: 2 | J187: 0 | K187: 1 | L187: 0 | M187: 1 | N187: 0 | O187: 0 | P187: 0 | Q187: 0 | R187: 0 | S187: 0 | T187: 0 | U187: =F187+G187+H187+I187+J187+K187+L187+M187+N187+O187+P187+Q187+R187+S187+T187 -> 5
C188: LICENCIADO EN FILOLOGÍA ROMÁNICA | E188: Mujer | F188: 0 | G188: 0 | H188: 0 | I188: 0 | J188: 0 | K188: 0 | L188: 0 | M188: 1 | N188: 0 | O188: 2 | P188: 0 | Q188: 1 | R188: 1 | S188: 1 | T188: 1 | U188: =F188+G188+H188+I188+J188+K188+L188+M188+N188+O188+P188+Q188+R188+S188+T188 -> 7
C189: LICENCIADO EN FILOLOGÍA ÁRABE | D189: =U189+U190 -> 70 | E189: Hombre | F189: 0 | G189: 0 | H189: 6 | I189: 6 | J189: 2 | K189: 2 | L189: 2 | M189: 2 | N189: 0 | O189: 0 | P189: 1 | Q189: 2 | R189: 0 | S189: 0 | T189: 1 | U189: =F189+G189+H189+I189+J189+K189+L189+M189+N189+O189+P189+Q189+R189+S189+T189 -> 24
C190: LICENCIADO EN FILOLOGÍA ÁRABE | E190: Mujer | F190: 0 | G190: 0 | H190: 4 | I190: 1 | J190: 10 | K190: 4 | L190: 8 | M190: 2 | N190: 6 | O190: 3 | P190: 2 | Q190: 2 | R190: 0 | S190: 2 | T190: 2 | U190: =F190+G190+H190+I190+J190+K190+L190+M190+N190+O190+P190+Q190+R190+S190+T190 -> 46
C191: LICENCIADO EN FILOSOFÍA | D191: =U191+U192 -> 213 | E191: Hombre | F191: 0 | G191: 0 | H191: 7 | I191: 25 | J191: 23 | K191: 28 | L191: 14 | M191: 11 | N191: 9 | O191: 6 | P191: 3 | Q191: 2 | R191: 13 | S191: 2 | T191: 7 | U191: =F191+G191+H191+I191+J191+K191+L191+M191+N191+O191+P191+Q191+R191+S191+T191 -> 150
C192: LICENCIADO EN FILOSOFÍA | E192: Mujer | F192: 0 | G192: 0 | H192: 13 | I192: 10 | J192: 8 | K192: 9 | L192: 2 | M192: 3 | N192: 2 | O192: 4 | P192: 1 | Q192: 2 | R192: 3 | S192: 2 | T192: 4 | U192: =F192+G192+H192+I192+J192+K192+L192+M192+N192+O192+P192+Q192+R192+S192+T192 -> 63
C193: LICENCIADO EN GEOGRAFÍA | D193: =U193+U194 -> 108 | E193: Hombre | F193: 0 | G193: 0 | H193: 7 | I193: 15 | J193: 16 | K193: 9 | L193: 9 | M193: 3 | N193: 4 | O193: 6 | P193: 0 | Q193: 2 | R193: 4 | S193: 1 | T193: 3 | U193: =F193+G193+H193+I193+J193+K193+L193+M193+N193+O193+P193+Q193+R193+S193+T193 -> 79
C194: LICENCIADO EN GEOGRAFÍA | E194: Mujer | F194: 0 | G194: 0 | H194: 2 | I194: 9 | J194: 4 | K194: 1 | L194: 3 | M194: 1 | N194: 1 | O194: 1 | P194: 1 | Q194: 0 | R194: 1 | S194: 2 | T194: 3 | U194: =F194+G194+H194+I194+J194+K194+L194+M194+N194+O194+P194+Q194+R194+S194+T194 -> 29
C195: LICENCIADO EN HISTORIA | D195: =U195+U196 -> 513 | E195: Hombre | F195: 0 | G195: 1 | H195: 57 | I195: 65 | J195: 74 | K195: 43 | L195: 21 | M195: 18 | N195: 11 | O195: 11 | P195: 8 | Q195: 7 | R195: 16 | S195: 10 | T195: 15 | U195: =F195+G195+H195+I195+J195+K195+L195+M195+N195+O195+P195+Q195+R195+S195+T195 -> 357
C196: LICENCIADO EN HISTORIA | E196: Mujer | F196: 0 | G196: 0 | H196: 15 | I196: 29 | J196: 29 | K196: 16 | L196: 8 | M196: 10 | N196: 8 | O196: 7 | P196: 2 | Q196: 5 | R196: 5 | S196: 4 | T196: 18 | U196: =F196+G196+H196+I196+J196+K196+L196+M196+N196+O196+P196+Q196+R196+S196+T196 -> 156
C197: LICENCIADO EN HISTORIA DEL ARTE | D197: =U197+U198 -> 374 | E197: Hombre | F197: 0 | G197: 1 | H197: 9 | I197: 29 | J197: 14 | K197: 18 | L197: 16 | M197: 6 | N197: 10 | O197: 7 | P197: 6 | Q197: 2 | R197: 14 | S197: 10 | T197: 12 | U197: =F197+G197+H197+I197+J197+K197+L197+M197+N197+O197+P197+Q197+R197+S197+T197 -> 154
C198: LICENCIADO EN HISTORIA DEL ARTE | E198: Mujer | F198: 0 | G198: 0 | H198: 20 | I198: 33 | J198: 23 | K198: 15 | L198: 13 | M198: 16 | N198: 13 | O198: 5 | P198: 13 | Q198: 13 | R198: 26 | S198: 4 | T198: 26 | U198: =F198+G198+H198+I198+J198+K198+L198+M198+N198+O198+P198+Q198+R198+S198+T198 -> 220
C199: LICENCIADO EN HISTORIA Y CIENCIAS DE LA MUSICA | D199: =U199+U200 -> 96 | E199: Hombre | F199: 0 | G199: 0 | H199: 5 | I199: 2 | J199: 6 | K199: 6 | L199: 5 | M199: 4 | N199: 3 | O199: 0 | P199: 3 | Q199: 4 | R199: 5 | S199: 3 | T199: 1 | U199: =F199+G199+H199+I199+J199+K199+L199+M199+N199+O199+P199+Q199+R199+S199+T199 -> 47
C200: LICENCIADO EN HISTORIA Y CIENCIAS DE LA MUSICA | E200: Mujer | F200: 0 | G200: 0 | H200: 0 | I200: 0 | J200: 6 | K200: 4 | L200: 9 | M200: 4 | N200: 6 | O200: 2 | P200: 4 | Q200: 0 | R200: 3 | S200: 6 | T200: 5 | U200: =F200+G200+H200+I200+J200+K200+L200+M200+N200+O200+P200+Q200+R200+S200+T200 -> 49
C201: LICENCIADO EN TEORÍA DE LA LITERATURA Y LITERATURA COMPARADA | D201: =U201+U202 -> 90 | E201: Hombre | F201: 0 | G201: 0 | H201: 6 | I201: 7 | J201: 6 | K201: 2 | L201: 2 | M201: 3 | N201: 1 | O201: 0 | P201: 1 | Q201: 3 | R201: 4 | S201: 2 | T201: 3 | U201: =F201+G201+H201+I201+J201+K201+L201+M201+N201+O201+P201+Q201+R201+S201+T201 -> 40
C202: LICENCIADO EN TEORÍA DE LA LITERATURA Y LITERATURA COMPARADA | E202: Mujer | F202: 0 | G202: 0 | H202: 0 | I202: 0 | J202: 3 | K202: 7 | L202: 6 | M202: 8 | N202: 1 | O202: 1 | P202: 0 | Q202: 0 | R202: 15 | S202: 2 | T202: 7 | U202: =F202+G202+H202+I202+J202+K202+L202+M202+N202+O202+P202+Q202+R202+S202+T202 -> 50
A203: FAC. MEDICINA | B203: =D203+D205 -> 1732 | C203: GRADO EN MEDICINA | D203: =U203+U204 -> 507 | E203: Hombre | F203: 66 | G203: 79 | H203: 7 | I203: 1 | J203: 0 | K203: 2 | L203: 2 | M203: 2 | N203: 4 | O203: 0 | P203: 1 | Q203: 0 | R203: 5 | S203: 3 | T203: 0 | U203: =F203+G203+H203+I203+J203+K203+L203+M203+N203+O203+P203+Q203+R203+S203+T203 -> 172
C204: GRADO EN MEDICINA | E204: Mujer | F204: 135 | G204: 142 | H204: 29 | I204: 2 | J204: 2 | K204: 3 | L204: 5 | M204: 0 | N204: 1 | O204: 2 | P204: 1 | Q204: 2 | R204: 2 | S204: 1 | T204: 8 | U204: =F204+G204+H204+I204+J204+K204+L204+M204+N204+O204+P204+Q204+R204+S204+T204 -> 335
C205: LICENCIADO EN MEDICINA | D205: =U205+U206 -> 1225 | E205: Hombre | F205: 0 | G205: 2 | H205: 91 | I205: 94 | J205: 83 | K205: 73 | L205: 28 | M205: 15 | N205: 12 | O205: 8 | P205: 7 | Q205: 10 | R205: 18 | S205: 6 | T205: 28 | U205: =F205+G205+H205+I205+J205+K205+L205+M205+N205+O205+P205+Q205+R205+S205+T205 -> 475
C206: LICENCIADO EN MEDICINA | E206: Mujer | F206: 0 | G206: 2 | H206: 136 | I206: 149 | J206: 162 | K206: 177 | L206: 33 | M206: 22 | N206: 9 | O206: 8 | P206: 6 | Q206: 2 | R206: 21 | S206: 13 | T206: 10 | U206: =F206+G206+H206+I206+J206+K206+L206+M206+N206+O206+P206+Q206+R206+S206+T206 -> 750
A207: FAC. ODONTOLOGÍA | B207: =D207+D209 -> 480 | C207: GRADO EN ODONTOLOGÍA | D207: =U207+U208 -> 162 | E207: Hombre | F207: 19 | G207: 13 | H207: 10 | I207: 4 | J207: 3 | K207: 1 | L207: 4 | M207: 0 | N207: 0 | O207: 2 | P207: 0 | Q207: 1 | R207: 3 | S207: 1 | T207: 2 | U207: =F207+G207+H207+I207+J207+K207+L207+M207+N207+O207+P207+Q207+R207+S207+T207 -> 63
C208: GRADO EN ODONTOLOGÍA | E208: Mujer | F208: 35 | G208: 27 | H208: 9 | I208: 7 | J208: 5 | K208: 3 | L208: 2 | M208: 1 | N208: 2 | O208: 2 | P208: 0 | Q208: 1 | R208: 4 | S208: 0 | T208: 1 | U208: =F208+G208+H208+I208+J208+K208+L208+M208+N208+O208+P208+Q208+R208+S208+T208 -> 99
C209: LICENCIADO EN ODONTOLOGÍA | D209: =U209+U210 -> 318 | E209: Hombre | F209: 1 | G209: 0 | H209: 19 | I209: 19 | J209: 18 | K209: 20 | L209: 7 | M209: 3 | N209: 5 | O209: 2 | P209: 1 | Q209: 0 | R209: 2 | S209: 5 | T209: 3 | U209: =F209+G209+H209+I209+J209+K209+L209+M209+N209+O209+P209+Q209+R209+S209+T209 -> 105
C210: LICENCIADO EN ODONTOLOGÍA | E210: Mujer | F210: 0 | G210: 0 | H210: 47 | I210: 52 | J210: 59 | K210: 24 | L210: 8 | M210: 5 | N210: 3 | O210: 5 | P210: 0 | Q210: 0 | R210: 6 | S210: 2 | T210: 2 | U210: =F210+G210+H210+I210+J210+K210+L210+M210+N210+O210+P210+Q210+R210+S210+T210 -> 213
A211: FAC. PSICOLOGIA | B211: =D211+D213+D215+D217 -> 2140 | C211: DIPLOMADO EN LOGOPEDIA | D211: =U211+U212 -> 110 | E211: Hombre | F211: 0 | G211: 0 | H211: 1 | I211: 1 | J211: 1 | K211: 1 | L211: 0 | M211: 0 | N211: 0 | O211: 0 | P211: 0 | Q211: 1 | R211: 0 | S211: 2 | T211: 1 | U211: =F211+G211+H211+I211+J211+K211+L211+M211+N211+O211+P211+Q211+R211+S211+T211 -> 8
C212: DIPLOMADO EN LOGOPEDIA | E212: Mujer | F212: 0 | G212: 0 | H212: 26 | I212: 14 | J212: 16 | K212: 10 | L212: 6 | M212: 8 | N212: 7 | O212: 2 | P212: 4 | Q212: 2 | R212: 3 | S212: 3 | T212: 1 | U212: =F212+G212+H212+I212+J212+K212+L212+M212+N212+O212+P212+Q212+R212+S212+T212 -> 102
C213: GRADO EN LOGOPEDIA | D213: =U213+U214 -> 117 | E213: Hombre | F213: 0 | G213: 2 | H213: 1 | I213: 0 | J213: 0 | K213: 2 | L213: 0 | M213: 0 | N213: 0 | O213: 0 | P213: 0 | Q213: 0 | R213: 0 | S213: 1 | T213: 0 | U213: =F213+G213+H213+I213+J213+K213+L213+M213+N213+O213+P213+Q213+R213+S213+T213 -> 6
C214: GRADO EN LOGOPEDIA | E214: Mujer | F214: 27 | G214: 24 | H214: 13 | I214: 13 | J214: 12 | K214: 4 | L214: 2 | M214: 1 | N214: 1 | O214: 3 | P214: 2 | Q214: 1 | R214: 3 | S214: 1 | T214: 4 | U214: =F214+G214+H214+I214+J214+K214+L214+M214+N214+O214+P214+Q214+R214+S214+T214 -> 111
C215: GRADO EN PSICOLOGÍA | D215: =U215+U216 -> 641 | E215: Hombre | F215: 39 | G215: 39 | H215: 34 | I215: 14 | J215: 10 | K215: 8 | L215: 4 | M215: 5 | N215: 3 | O215: 2 | P215: 2 | Q215: 0 | R215: 2 | S215: 0 | T215: 8 | U215: =F215+G215+H215+I215+J215+K215+L215+M215+N215+O215+P215+Q215+R215+S215+T215 -> 170
C216: GRADO EN PSICOLOGÍA | E216: Mujer | F216: 158 | G216: 174 | H216: 40 | I216: 22 | J216: 14 | K216: 13 | L216: 10 | M216: 4 | N216: 8 | O216: 3 | P216: 3 | Q216: 0 | R216: 3 | S216: 8 | T216: 11 | U216: =F216+G216+H216+I216+J216+K216+L216+M216+N216+O216+P216+Q216+R216+S216+T216 -> 471
C217: LICENCIADO EN PSICOLOGÍA | D217: =U217+U218 -> 1272 | E217: Hombre | F217: 0 | G217: 0 | H217: 37 | I217: 75 | J217: 77 | K217: 39 | L217: 34 | M217: 25 | N217: 13 | O217: 11 | P217: 7 | Q217: 10 | R217: 18 | S217: 9 | T217: 12 | U217: =F217+G217+H217+I217+J217+K217+L217+M217+N217+O217+P217+Q217+R217+S217+T217 -> 367
C218: LICENCIADO EN PSICOLOGÍA | E218: Mujer | F218: 0 | G218: 1 | H218: 152 | I218: 170 | J218: 177 | K218: 115 | L218: 81 | M218: 36 | N218: 38 | O218: 36 | P218: 14 | Q218: 15 | R218: 27 | S218: 19 | T218: 24 | U218: =F218+G218+H218+I218+J218+K218+L218+M218+N218+O218+P218+Q218+R218+S218+T218 -> 905
A219: FAC. TRADUCCIÓN INTERPRETACION | B219: =D219+D221 -> 1700 | C219: GRADO EN TRADUCCIÓN E INTERPRETACIÓN | D219: =U219+U220 -> 585 | E219: Hombre | F219: 40 | G219: 57 | H219: 19 | I219: 19 | J219: 8 | K219: 7 | L219: 2 | M219: 6 | N219: 3 | O219: 3 | P219: 3 | Q219: 3 | R219: 3 | S219: 1 | T219: 7 | U219: =F219+G219+H219+I219+J219+K219+L219+M219+N219+O219+P219+Q219+R219+S219+T219 -> 181
C220: GRADO EN TRADUCCIÓN E INTERPRETACIÓN | E220: Mujer | F220: 163 | G220: 148 | H220: 28 | I220: 18 | J220: 8 | K220: 6 | L220: 7 | M220: 3 | N220: 3 | O220: 3 | P220: 1 | Q220: 1 | R220: 8 | S220: 3 | T220: 4 | U220: =F220+G220+H220+I220+J220+K220+L220+M220+N220+O220+P220+Q220+R220+S220+T220 -> 404
C221: LICENCIADO EN TRADUCCIÓN E INTERPRETACIÓN | D221: =U221+U222 -> 1115 | E221: Hombre | F221: 1 | G221: 11 | H221: 98 | I221: 104 | J221: 61 | K221: 38 | L221: 29 | M221: 21 | N221: 14 | O221: 7 | P221: 11 | Q221: 4 | R221: 18 | S221: 5 | T221: 12 | U221: =F221+G221+H221+I221+J221+K221+L221+M221+N221+O221+P221+Q221+R221+S221+T221 -> 434
C222: LICENCIADO EN TRADUCCIÓN E INTERPRETACIÓN | E222: Mujer | F222: 0 | G222: 2 | H222: 130 | I222: 148 | J222: 121 | K222: 74 | L222: 47 | M222: 26 | N222: 36 | O222: 19 | P222: 9 | Q222: 6 | R222: 29 | S222: 19 | T222: 15 | U222: =F222+G222+H222+I222+J222+K222+L222+M222+N222+O222+P222+Q222+R222+S222+T222 -> 681
A223: E.T.S. ARQUITECTURA | B223: =D223+D225 -> 1754 | C223: ARQUITECTO | D223: =U223+U224 -> 1420 | E223: Hombre | F223: 0 | G223: 0 | H223: 53 | I223: 77 | J223: 80 | K223: 80 | L223: 87 | M223: 77 | N223: 61 | O223: 46 | P223: 41 | Q223: 38 | R223: 95 | S223: 33 | T223: 12 | U223: =F223+G223+H223+I223+J223+K223+L223+M223+N223+O223+P223+Q223+R223+S223+T223 -> 780
C224: ARQUITECTO | E224: Mujer | F224: 0 | G224: 0 | H224: 43 | I224: 68 | J224: 81 | K224: 86 | L224: 92 | M224: 66 | N224: 60 | O224: 42 | P224: 32 | Q224: 21 | R224: 41 | S224: 6 | T224: 2 | U224: =F224+G224+H224+I224+J224+K224+L224+M224+N224+O224+P224+Q224+R224+S224+T224 -> 640
C225: GRADO EN ARQUITECTURA | D225: =U225+U226 -> 334 | E225: Hombre | F225: 71 | G225: 57 | H225: 19 | I225: 8 | J225: 3 | K225: 7 | L225: 2 | M225: 3 | N225: 5 | O225: 1 | P225: 0 | Q225: 0 | R225: 4 | S225: 2 | T225: 1 | U225: =F225+G225+H225+I225+J225+K225+L225+M225+N225+O225+P225+Q225+R225+S225+T225 -> 183
C226: GRADO EN ARQUITECTURA | E226: Mujer | F226: 60 | G226: 52 | H226: 17 | I226: 9 | J226: 2 | K226: 3 | L226: 2 | M226: 1 | N226: 1 | O226: 0 | P226: 1 | Q226: 0 | R226: 1 | S226: 1 | T226: 1 | U226: =F226+G226+H226+I226+J226+K226+L226+M226+N226+O226+P226+Q226+R226+S226+T226 -> 151
A227: ETS INFORMÁTICA Y TELECOMUNI. | B227: =D227+D229+D231+D233+D235+D237 -> 2375 | C227: GRADO EN INGENIERÍA DE TECNOLOGÍAS DE TELECOMUNICACIÓN | D227: =U227+U228 -> 245 | E227: Hombre | F227: 69 | G227: 58 | H227: 37 | I227: 7 | J227: 3 | K227: 2 | L227: 1 | M227: 2 | N227: 0 | O227: 0 | P227: 0 | Q227: 1 | R227: 2 | S227: 0 | T227: 2 | U227: =F227+G227+H227+I227+J227+K227+L227+M227+N227+O227+P227+Q227+R227+S227+T227 -> 184
C228: GRADO EN INGENIERÍA DE TECNOLOGÍAS DE TELECOMUNICACIÓN | E228: Mujer | F228: 19 | G228: 15 | H228: 18 | I228: 4 | J228: 1 | K228: 0 | L228: 1 | M228: 0 | N228: 1 | O228: 0 | P228: 0 | Q228: 0 | R228: 1 | S228: 0 | T228: 1 | U228: =F228+G228+H228+I228+J228+K228+L228+M228+N228+O228+P228+Q228+R228+S228+T228 -> 61
C229: GRADO EN INGENIERÍA INFORMÁTICA | D229: =U229+U230 -> 746 | E229: Hombre | F229: 110 | G229: 145 | H229: 90 | I229: 81 | J229: 56 | K229: 37 | L229: 29 | M229: 18 | N229: 14 | O229: 8 | P229: 4 | Q229: 4 | R229: 10 | S229: 1 | T229: 3 | U229: =F229+G229+H229+I229+J229+K229+L229+M229+N229+O229+P229+Q229+R229+S229+T229 -> 610
C230: GRADO EN INGENIERÍA INFORMÁTICA | E230: Mujer | F230: 17 | G230: 16 | H230: 32 | I230: 28 | J230: 9 | K230: 9 | L230: 9 | M230: 1 | N230: 1 | O230: 2 | P230: 1 | Q230: 2 | R230: 7 | S230: 0 | T230: 2 | U230: =F230+G230+H230+I230+J230+K230+L230+M230+N230+O230+P230+Q230+R230+S230+T230 -> 136
C231: INGENIERO DE TELECOMUNICACIÓN | D231: =U231+U232 -> 398 | E231: Hombre | F231: 0 | G231: 1 | H231: 27 | I231: 57 | J231: 60 | K231: 68 | L231: 40 | M231: 28 | N231: 14 | O231: 9 | P231: 3 | Q231: 1 | R231: 5 | S231: 0 | T231: 1 | U231: =F231+G231+H231+I231+J231+K231+L231+M231+N231+O231+P231+Q231+R231+S231+T231 -> 314
C232: INGENIERO DE TELECOMUNICACIÓN | E232: Mujer | F232: 0 | G232: 0 | H232: 13 | I232: 18 | J232: 18 | K232: 9 | L232: 14 | M232: 4 | N232: 5 | O232: 2 | P232: 0 | Q232: 1 | R232: 0 | S232: 0 | T232: 0 | U232: =F232+G232+H232+I232+J232+K232+L232+M232+N232+O232+P232+Q232+R232+S232+T232 -> 84
C233: INGENIERO EN INFORMÁTICA | D233: =U233+U234 -> 510 | E233: Hombre | F233: 0 | G233: 0 | H233: 11 | I233: 53 | J233: 51 | K233: 80 | L233: 73 | M233: 48 | N233: 31 | O233: 30 | P233: 19 | Q233: 13 | R233: 31 | S233: 5 | T233: 2 | U233: =F233+G233+H233+I233+J233+K233+L233+M233+N233+O233+P233+Q233+R233+S233+T233 -> 447
C234: INGENIERO EN INFORMÁTICA | E234: Mujer | F234: 0 | G234: 0 | H234: 2 | I234: 3 | J234: 5 | K234: 5 | L234: 10 | M234: 11 | N234: 9 | O234: 7 | P234: 5 | Q234: 2 | R234: 2 | S234: 0 | T234: 2 | U234: =F234+G234+H234+I234+J234+K234+L234+M234+N234+O234+P234+Q234+R234+S234+T234 -> 63
C235: INGENIERO TÉCNICO EN INFORMÁTICA DE GESTIÓN | D235: =U235+U236 -> 246 | E235: Hombre | F235: 0 | G235: 0 | H235: 5 | I235: 10 | J235: 20 | K235: 23 | L235: 26 | M235: 20 | N235: 20 | O235: 21 | P235: 13 | Q235: 13 | R235: 19 | S235: 10 | T235: 0 | U235: =F235+G235+H235+I235+J235+K235+L235+M235+N235+O235+P235+Q235+R235+S235+T235 -> 200
C236: INGENIERO TÉCNICO EN INFORMÁTICA DE GESTIÓN | E236: Mujer | F236: 0 | G236: 0 | H236: 0 | I236: 2 | J236: 10 | K236: 12 | L236: 4 | M236: 5 | N236: 1 | O236: 2 | P236: 1 | Q236: 1 | R236: 4 | S236: 2 | T236: 2 | U236: =F236+G236+H236+I236+J236+K236+L236+M236+N236+O236+P236+Q236+R236+S236+T236 -> 46
C237: INGENIERO TÉCNICO EN INFORMÁTICA DE SISTEMAS | D237: =U237+U238 -> 230 | E237: Hombre | F237: 0 | G237: 0 | H237: 5 | I237: 14 | J237: 33 | K237: 23 | L237: 35 | M237: 19 | N237: 15 | O237: 12 | P237: 9 | Q237: 5 | R237: 15 | S237: 9 | T237: 4 | U237: =F237+G237+H237+I237+J237+K237+L237+M237+N237+O237+P237+Q237+R237+S237+T237 -> 198
C238: INGENIERO TÉCNICO EN INFORMÁTICA DE SISTEMAS | E238: Mujer | F238: 0 | G238: 0 | H238: 0 | I238: 4 | J238: 3 | K238: 10 | L238: 2 | M238: 1 | N238: 3 | O238: 1 | P238: 1 | Q238: 1 | R238: 5 | S238: 1 | T238: 0 | U238: =F238+G238+H238+I238+J238+K238+L238+M238+N238+O238+P238+Q238+R238+S238+T238 -> 32
A239: ETS CAMINOS CANALES Y PUERTOS | B239: =D239+D241+D243 -> 1652 | C239: GRADO EN INGENIERÍA CIVIL | D239: =U239+U240 -> 512 | E239: Hombre | F239: 120 | G239: 119 | H239: 58 | I239: 27 | J239: 9 | K239: 11 | L239: 7 | M239: 9 | N239: 2 | O239: 1 | P239: 4 | Q239: 1 | R239: 3 | S239: 0 | T239: 2 | U239: =F239+G239+H239+I239+J239+K239+L239+M239+N239+O239+P239+Q239+R239+S239+T239 -> 373
C240: GRADO EN INGENIERÍA CIVIL | E240: Mujer | F240: 50 | G240: 44 | H240: 22 | I240: 8 | J240: 8 | K240: 5 | L240: 0 | M240: 2 | N240: 0 | O240: 0 | P240: 0 | Q240: 0 | R240: 0 | S240: 0 | T240: 0 | U240: =F240+G240+H240+I240+J240+K240+L240+M240+N240+O240+P240+Q240+R240+S240+T240 -> 139
C241: INGENIERO/A DE CAMINOS, CANALES Y PUERTOS | D241: =U241+U242 -> 1139 | E241: Hombre | F241: 0 | G241: 3 | H241: 74 | I241: 129 | J241: 122 | K241: 124 | L241: 110 | M241: 68 | N241: 62 | O241: 25 | P241: 22 | Q241: 21 | R241: 31 | S241: 22 | T241: 11 | U241: =F241+G241+H241+I241+J241+K241+L241+M241+N241+O241+P241+Q241+R241+S241+T241 -> 824
C242: INGENIERO/A DE CAMINOS, CANALES Y PUERTOS | E242: Mujer | F242: 0 | G242: 1 | H242: 30 | I242: 41 | J242: 51 | K242: 50 | L242: 38 | M242: 36 | N242: 31 | O242: 10 | P242: 8 | Q242: 4 | R242: 7 | S242: 7 | T242: 1 | U242: =F242+G242+H242+I242+J242+K242+L242+M242+N242+O242+P242+Q242+R242+S242+T242 -> 315
C243: INGENIERÍA SUPERIOR DE CAMINOS, CANALES Y PUERTOS | D243: =U243+U244 -> 1 | E243: Hombre | F243: 0 | G243: 0 | H243: 0 | I243: 0 | J243: 0 | K243: 0 | L243: 0 | M243: 0 | N243: 0 | O243: 0 | P243: 0 | Q243: 1 | R243: 0 | S243: 0 | T243: 0 | U243: =F243+G243+H243+I243+J243+K243+L243+M243+N243+O243+P243+Q243+R243+S243+T243 -> 1
C244: INGENIERÍA SUPERIOR DE CAMINOS, CANALES Y PUERTOS | E244: Mujer | F244: 0 | G244: 0 | H244: 0 | I244: 0 | J244: 0 | K244: 0 | L244: 0 | M244: 0 | N244: 0 | O244: 0 | P244: 0 | Q244: 0 | R244: 0 | S244: 0 | T244: 0 | U244: =F244+G244+H244+I244+J244+K244+L244+M244+N244+O244+P244+Q244+R244+S244+T244 -> 0
A245: E.T.S.I. DE EDIFICACIÓN | B245: =D245+D247+D249 -> 2240 | C245: ARQUITECTURA TÉCNICA | D245: =U245+U246 -> 1405 | E245: Hombre | F245: 0 | G245: 0 | H245: 84 | I245: 107 | J245: 82 | K245: 80 | L245: 81 | M245: 89 | N245: 78 | O245: 39 | P245: 47 | Q245: 47 | R245: 129 | S245: 42 | T245: 36 | U245: =F245+G245+H245+I245+J245+K245+L245+M245+N245+O245+P245+Q245+R245+S245+T245 -> 941
C246: ARQUITECTURA TÉCNICA | E246: Mujer | F246: 0 | G246: 0 | H246: 47 | I246: 76 | J246: 77 | K246: 52 | L246: 41 | M246: 40 | N246: 32 | O246: 17 | P246: 13 | Q246: 17 | R246: 33 | S246: 14 | T246: 5 | U246: =F246+G246+H246+I246+J246+K246+L246+M246+N246+O246+P246+Q246+R246+S246+T246 -> 464
C247: GRADO EN INGENIERIA EN EDIFICACIÓN (CURSO PUENTE) | D247: =U247+U248 -> 58 | E247: Hombre | F247: 0 | G247: 0 | H247: 0 | I247: 1 | J247: 8 | K247: 0 | L247: 5 | M247: 3 | N247: 1 | O247: 4 | P247: 1 | Q247: 0 | R247: 5 | S247: 0 | T247: 1 | U247: =F247+G247+H247+I247+J247+K247+L247+M247+N247+O247+P247+Q247+R247+S247+T247 -> 29
C248: GRADO EN INGENIERIA EN EDIFICACIÓN (CURSO PUENTE) | E248: Mujer | F248: 0 | G248: 0 | H248: 0 | I248: 0 | J248: 9 | K248: 4 | L248: 1 | M248: 6 | N248: 3 | O248: 0 | P248: 1 | Q248: 1 | R248: 4 | S248: 0 | T248: 0 | U248: =F248+G248+H248+I248+J248+K248+L248+M248+N248+O248+P248+Q248+R248+S248+T248 -> 29
C249: GRADO EN INGENIERÍA DE EDIFICACIÓN | D249: =U249+U250 -> 777 | E249: Hombre | F249: 81 | G249: 109 | H249: 74 | I249: 57 | J249: 53 | K249: 25 | L249: 23 | M249: 19 | N249: 4 | O249: 9 | P249: 5 | Q249: 4 | R249: 16 | S249: 5 | T249: 16 | U249: =F249+G249+H249+I249+J249+K249+L249+M249+N249+O249+P249+Q249+R249+S249+T249 -> 500
C250: GRADO EN INGENIERÍA DE EDIFICACIÓN | E250: Mujer | F250: 46 | G250: 67 | H250: 32 | I250: 31 | J250: 39 | K250: 19 | L250: 8 | M250: 9 | N250: 8 | O250: 5 | P250: 2 | Q250: 1 | R250: 7 | S250: 2 | T250: 1 | U250: =F250+G250+H250+I250+J250+K250+L250+M250+N250+O250+P250+Q250+R250+S250+T250 -> 277
A251: FAC. COMUNICACIÓN Y DOCUMENTA. | B251: =D251+D253+D255+D257+D259 -> 609 | C251: DIPLOMADO EN BIBLIOTECONOMÍA Y DOCUMENTACIÓN | D251: =U251+U252 -> 83 | E251: Hombre | F251: 0 | G251: 0 | H251: 6 | I251: 4 | J251: 4 | K251: 1 | L251: 1 | M251: 3 | N251: 1 | O251: 2 | P251: 3 | Q251: 1 | R251: 10 | S251: 1 | T251: 2 | U251: =F251+G251+H251+I251+J251+K251+L251+M251+N251+O251+P251+Q251+R251+S251+T251 -> 39
C252: DIPLOMADO EN BIBLIOTECONOMÍA Y DOCUMENTACIÓN | E252: Mujer | F252: 0 | G252: 0 | H252: 3 | I252: 6 | J252: 4 | K252: 4 | L252: 3 | M252: 5 | N252: 2 | O252: 2 | P252: 0 | Q252: 1 | R252: 4 | S252: 5 | T252: 5 | U252: =F252+G252+H252+I252+J252+K252+L252+M252+N252+O252+P252+Q252+R252+S252+T252 -> 44
C253: GRADO EN COMUNICACIÓN AUDIOVISUAL | D253: =U253+U254 -> 130 | E253: Hombre | F253: 11 | G253: 18 | H253: 6 | I253: 6 | J253: 4 | K253: 2 | L253: 3 | M253: 4 | N253: 2 | O253: 1 | P253: 1 | Q253: 0 | R253: 1 | S253: 2 | T253: 2 | U253: =F253+G253+H253+I253+J253+K253+L253+M253+N253+O253+P253+Q253+R253+S253+T253 -> 63
C254: GRADO EN COMUNICACIÓN AUDIOVISUAL | E254: Mujer | F254: 34 | G254: 15 | H254: 3 | I254: 5 | J254: 2 | K254: 2 | L254: 0 | M254: 4 | N254: 1 | O254: 0 | P254: 0 | Q254: 0 | R254: 0 | S254: 1 | T254: 0 | U254: =F254+G254+H254+I254+J254+K254+L254+M254+N254+O254+P254+Q254+R254+S254+T254 -> 67
C255: GRADO EN INFORMACIÓN Y DOCUMENTACIÓN | D255: =U255+U256 -> 148 | E255: Hombre | F255: 9 | G255: 12 | H255: 13 | I255: 0 | J255: 3 | K255: 11 | L255: 0 | M255: 3 | N255: 3 | O255: 1 | P255: 0 | Q255: 0 | R255: 0 | S255: 1 | T255: 2 | U255: =F255+G255+H255+I255+J255+K255+L255+M255+N255+O255+P255+Q255+R255+S255+T255 -> 58
C256: GRADO EN INFORMACIÓN Y DOCUMENTACIÓN | E256: Mujer | F256: 21 | G256: 21 | H256: 10 | I256: 6 | J256: 9 | K256: 6 | L256: 4 | M256: 3 | N256: 3 | O256: 1 | P256: 0 | Q256: 0 | R256: 1 | S256: 0 | T256: 5 | U256: =F256+G256+H256+I256+J256+K256+L256+M256+N256+O256+P256+Q256+R256+S256+T256 -> 90
C257: LICENCIADO EN COMUNICACIÓN AUDIOVISUAL | D257: =U257+U258 -> 115 | E257: Hombre | F257: 0 | G257: 0 | H257: 4 | I257: 8 | J257: 6 | K257: 7 | L257: 10 | M257: 7 | N257: 4 | O257: 4 | P257: 2 | Q257: 2 | R257: 7 | S257: 5 | T257: 7 | U257: =F257+G257+H257+I257+J257+K257+L257+M257+N257+O257+P257+Q257+R257+S257+T257 -> 73
C258: LICENCIADO EN COMUNICACIÓN AUDIOVISUAL | E258: Mujer | F258: 0 | G258: 0 | H258: 0 | I258: 0 | J258: 2 | K258: 3 | L258: 5 | M258: 6 | N258: 5 | O258: 5 | P258: 2 | Q258: 5 | R258: 7 | S258: 2 | T258: 0 | U258: =F258+G258+H258+I258+J258+K258+L258+M258+N258+O258+P258+Q258+R258+S258+T258 -> 42
C259: LICENCIADO EN DOCUMENTACIÓN | D259: =U259+U260 -> 133 | E259: Hombre | F259: 0 | G259: 0 | H259: 0 | I259: 1 | J259: 5 | K259: 5 | L259: 7 | M259: 8 | N259: 9 | O259: 0 | P259: 2 | Q259: 1 | R259: 4 | S259: 1 | T259: 3 | U259: =F259+G259+H259+I259+J259+K259+L259+M259+N259+O259+P259+Q259+R259+S259+T259 -> 46
C260: LICENCIADO EN DOCUMENTACIÓN | E260: Mujer | F260: 0 | G260: 0 | H260: 0 | I260: 12 | J260: 13 | K260: 6 | L260: 6 | M260: 5 | N260: 9 | O260: 7 | P260: 3 | Q260: 4 | R260: 5 | S260: 2 | T260: 15 | U260: =F260+G260+H260+I260+J260+K260+L260+M260+N260+O260+P260+Q260+R260+S260+T260 -> 87
A261: F. DE CIENCIAS DE LA SALUD | B261: =D261+D263+D265+D267+D269+D271 -> 934 | C261: DIPLOMADO EN ENFERMERÍA | D261: =U261+U262 -> 239 | E261: Hombre | F261: 0 | G261: 0 | H261: 19 | I261: 8 | J261: 6 | K261: 8 | L261: 2 | M261: 1 | N261: 2 | O261: 1 | P261: 1 | Q261: 1 | R261: 5 | S261: 3 | T261: 3 | U261: =F261+G261+H261+I261+J261+K261+L261+M261+N261+O261+P261+Q261+R261+S261+T261 -> 60
C262: DIPLOMADO EN ENFERMERÍA | E262: Mujer | F262: 0 | G262: 0 | H262: 49 | I262: 17 | J262: 20 | K262: 15 | L262: 12 | M262: 10 | N262: 6 | O262: 7 | P262: 5 | Q262: 3 | R262: 16 | S262: 5 | T262: 14 | U262: =F262+G262+H262+I262+J262+K262+L262+M262+N262+O262+P262+Q262+R262+S262+T262 -> 179
C263: DIPLOMADO EN FISIOTERAPIA | D263: =U263+U264 -> 108 | E263: Hombre | F263: 0 | G263: 0 | H263: 4 | I263: 13 | J263: 4 | K263: 5 | L263: 5 | M263: 5 | N263: 4 | O263: 0 | P263: 3 | Q263: 2 | R263: 3 | S263: 3 | T263: 2 | U263: =F263+G263+H263+I263+J263+K263+L263+M263+N263+O263+P263+Q263+R263+S263+T263 -> 53
C264: DIPLOMADO EN FISIOTERAPIA | E264: Mujer | F264: 0 | G264: 0 | H264: 18 | I264: 8 | J264: 4 | K264: 5 | L264: 4 | M264: 3 | N264: 1 | O264: 1 | P264: 3 | Q264: 0 | R264: 4 | S264: 1 | T264: 3 | U264: =F264+G264+H264+I264+J264+K264+L264+M264+N264+O264+P264+Q264+R264+S264+T264 -> 55
C265: DIPLOMADO EN TERAPIA OCUPACIONAL | D265: =U265+U266 -> 87 | E265: Hombre | F265: 0 | G265: 0 | H265: 4 | I265: 1 | J265: 1 | K265: 1 | L265: 2 | M265: 0 | N265: 1 | O265: 3 | P265: 2 | Q265: 0 | R265: 0 | S265: 1 | T265: 0 | U265: =F265+G265+H265+I265+J265+K265+L265+M265+N265+O265+P265+Q265+R265+S265+T265 -> 16
C266: DIPLOMADO EN TERAPIA OCUPACIONAL | E266: Mujer | F266: 0 | G266: 0 | H266: 27 | I266: 6 | J266: 8 | K266: 5 | L266: 10 | M266: 2 | N266: 3 | O266: 0 | P266: 3 | Q266: 2 | R266: 2 | S266: 2 | T266: 1 | U266: =F266+G266+H266+I266+J266+K266+L266+M266+N266+O266+P266+Q266+R266+S266+T266 -> 71
C267: GRADO EN ENFERMERÍA | D267: =U267+U268 -> 274 | E267: Hombre | F267: 29 | G267: 20 | H267: 3 | I267: 1 | J267: 0 | K267: 2 | L267: 7 | M267: 1 | N267: 0 | O267: 0 | P267: 0 | Q267: 0 | R267: 2 | S267: 1 | T267: 3 | U267: =F267+G267+H267+I267+J267+K267+L267+M267+N267+O267+P267+Q267+R267+S267+T267 -> 69
C268: GRADO EN ENFERMERÍA | E268: Mujer | F268: 67 | G268: 49 | H268: 16 | I268: 13 | J268: 15 | K268: 4 | L268: 5 | M268: 3 | N268: 1 | O268: 0 | P268: 3 | Q268: 3 | R268: 6 | S268: 3 | T268: 17 | U268: =F268+G268+H268+I268+J268+K268+L268+M268+N268+O268+P268+Q268+R268+S268+T268 -> 205
C269: GRADO EN FISIOTERAPIA | D269: =U269+U270 -> 110 | E269: Hombre | F269: 15 | G269: 10 | H269: 8 | I269: 4 | J269: 2 | K269: 0 | L269: 3 | M269: 2 | N269: 0 | O269: 2 | P269: 1 | Q269: 0 | R269: 0 | S269: 1 | T269: 2 | U269: =F269+G269+H269+I269+J269+K269+L269+M269+N269+O269+P269+Q269+R269+S269+T269 -> 50
C270: GRADO EN FISIOTERAPIA | E270: Mujer | F270: 22 | G270: 14 | H270: 3 | I270: 7 | J270: 1 | K270: 1 | L270: 2 | M270: 1 | N270: 1 | O270: 3 | P270: 1 | Q270: 0 | R270: 1 | S270: 1 | T270: 2 | U270: =F270+G270+H270+I270+J270+K270+L270+M270+N270+O270+P270+Q270+R270+S270+T270 -> 60
C271: GRADO EN TERAPIA OCUPACIONAL | D271: =U271+U272 -> 116 | E271: Hombre | F271: 3 | G271: 5 | H271: 2 | I271: 2 | J271: 4 | K271: 1 | L271: 0 | M271: 0 | N271: 2 | O271: 0 | P271: 2 | Q271: 0 | R271: 0 | S271: 1 | T271: 0 | U271: =F271+G271+H271+I271+J271+K271+L271+M271+N271+O271+P271+Q271+R271+S271+T271 -> 22
C272: GRADO EN TERAPIA OCUPACIONAL | E272: Mujer | F272: 23 | G272: 17 | H272: 6 | I272: 12 | J272: 13 | K272: 3 | L272: 2 | M272: 6 | N272: 1 | O272: 2 | P272: 0 | Q272: 0 | R272: 3 | S272: 2 | T272: 4 | U272: =F272+G272+H272+I272+J272+K272+L272+M272+N272+O272+P272+Q272+R272+S272+T272 -> 94
A273: FAC. CIENCIAS DEL TRABAJO | B273: =D273+D275+D277 -> 2082 | C273: DIPLOMADO EN RELACIONES LABORALES | D273: =U273+U274 -> 1011 | E273: Hombre | F273: 0 | G273: 0 | H273: 25 | I273: 37 | J273: 40 | K273: 54 | L273: 54 | M273: 32 | N273: 19 | O273: 23 | P273: 19 | Q273: 6 | R273: 29 | S273: 14 | T273: 14 | U273: =F273+G273+H273+I273+J273+K273+L273+M273+N273+O273+P273+Q273+R273+S273+T273 -> 366
C274: DIPLOMADO EN RELACIONES LABORALES | E274: Mujer | F274: 0 | G274: 0 | H274: 43 | I274: 84 | J274: 96 | K274: 79 | L274: 79 | M274: 47 | N274: 39 | O274: 21 | P274: 22 | Q274: 13 | R274: 73 | S274: 33 | T274: 16 | U274: =F274+G274+H274+I274+J274+K274+L274+M274+N274+O274+P274+Q274+R274+S274+T274 -> 645
C275: GRADO EN RELACIONES LABORALES Y RECURSOS HUMANOS | D275: =U275+U276 -> 712 | E275: Hombre | F275: 41 | G275: 66 | H275: 47 | I275: 40 | J275: 21 | K275: 24 | L275: 10 | M275: 11 | N275: 6 | O275: 3 | P275: 3 | Q275: 1 | R275: 2 | S275: 2 | T275: 15 | U275: =F275+G275+H275+I275+J275+K275+L275+M275+N275+O275+P275+Q275+R275+S275+T275 -> 292
C276: GRADO EN RELACIONES LABORALES Y RECURSOS HUMANOS | E276: Mujer | F276: 65 | G276: 136 | H276: 69 | I276: 45 | J276: 27 | K276: 21 | L276: 11 | M276: 13 | N276: 8 | O276: 1 | P276: 0 | Q276: 1 | R276: 6 | S276: 3 | T276: 14 | U276: =F276+G276+H276+I276+J276+K276+L276+M276+N276+O276+P276+Q276+R276+S276+T276 -> 420
C277: LICENCIADO EN CIENCIAS DEL TRABAJO | D277: =U277+U278 -> 359 | E277: Hombre | F277: 0 | G277: 0 | H277: 0 | I277: 8 | J277: 13 | K277: 10 | L277: 18 | M277: 14 | N277: 9 | O277: 4 | P277: 5 | Q277: 4 | R277: 7 | S277: 4 | T277: 16 | U277: =F277+G277+H277+I277+J277+K277+L277+M277+N277+O277+P277+Q277+R277+S277+T277 -> 112
C278: LICENCIADO EN CIENCIAS DEL TRABAJO | E278: Mujer | F278: 0 | G278: 0 | H278: 0 | I278: 17 | J278: 44 | K278: 40 | L278: 38 | M278: 19 | N278: 18 | O278: 12 | P278: 5 | Q278: 8 | R278: 15 | S278: 9 | T278: 22 | U278: =F278+G278+H278+I278+J278+K278+L278+M278+N278+O278+P278+Q278+R278+S278+T278 -> 247
A279: FACULTAD DE TRABAJO SOCIAL | B279: =D279+D281 -> 681 | C279: DIPLOMADO EN TRABAJO SOCIAL | D279: =U279+U280 -> 331 | E279: Hombre | F279: 0 | G279: 1 | H279: 12 | I279: 11 | J279: 7 | K279: 12 | L279: 6 | M279: 9 | N279: 1 | O279: 5 | P279: 6 | Q279: 4 | R279: 9 | S279: 2 | T279: 5 | U279: =F279+G279+H279+I279+J279+K279+L279+M279+N279+O279+P279+Q279+R279+S279+T279 -> 90
C280: DIPLOMADO EN TRABAJO SOCIAL | E280: Mujer | F280: 0 | G280: 0 | H280: 51 | I280: 35 | J280: 20 | K280: 21 | L280: 27 | M280: 18 | N280: 10 | O280: 10 | P280: 8 | Q280: 10 | R280: 16 | S280: 5 | T280: 10 | U280: =F280+G280+H280+I280+J280+K280+L280+M280+N280+O280+P280+Q280+R280+S280+T280 -> 241
C281: GRADO EN TRABAJO SOCIAL | D281: =U281+U282 -> 350 | E281: Hombre | F281: 6 | G281: 12 | H281: 11 | I281: 7 | J281: 12 | K281: 4 | L281: 4 | M281: 0 | N281: 4 | O281: 1 | P281: 1 | Q281: 0 | R281: 4 | S281: 1 | T281: 5 | U281: =F281+G281+H281+I281+J281+K281+L281+M281+N281+O281+P281+Q281+R281+S281+T281 -> 72
C282: GRADO EN TRABAJO SOCIAL | E282: Mujer | F282: 44 | G282: 81 | H282: 27 | I282: 29 | J282: 32 | K282: 14 | L282: 11 | M282: 6 | N282: 6 | O282: 9 | P282: 3 | Q282: 3 | R282: 2 | S282: 1 | T282: 10 | U282: =F282+G282+H282+I282+J282+K282+L282+M282+N282+O282+P282+Q282+R282+S282+T282 -> 278
A283: FAC. EDUCACION HUMANIDAD.CEUTA | B283: =D283+D285+D287+D289+D291+D293+D295+D297+D299+D301+D303+D305+D307+D309+D311 -> 820 | C283: DIPLOMADO EN CIENCIAS EMPRESARIALES "CEUTA" | D283: =U283+U284 -> 62 | E283: Hombre | F283: 0 | G283: 0 | H283: 2 | I283: 4 | J283: 3 | K283: 9 | L283: 4 | M283: 2 | N283: 3 | O283: 1 | P283: 1 | Q283: 0 | R283: 3 | S283: 1 | T283: 1 | U283: =F283+G283+H283+I283+J283+K283+L283+M283+N283+O283+P283+Q283+R283+S283+T283 -> 34
C284: DIPLOMADO EN CIENCIAS EMPRESARIALES "CEUTA" | E284: Mujer | F284: 0 | G284: 0 | H284: 4 | I284: 3 | J284: 6 | K284: 3 | L284: 2 | M284: 2 | N284: 2 | O284: 1 | P284: 1 | Q284: 1 | R284: 3 | S284: 0 | T284: 0 | U284: =F284+G284+H284+I284+J284+K284+L284+M284+N284+O284+P284+Q284+R284+S284+T284 -> 28
C285: GRADO EN ADMINISTRACIÓN Y DIRECCIÓN DE EMPRESAS (CEUTA) | D285: =U285+U286 -> 69 | E285: Hombre | F285: 5 | G285: 10 | H285: 4 | I285: 4 | J285: 5 | K285: 1 | L285: 4 | M285: 1 | N285: 3 | O285: 0 | P285: 1 | Q285: 0 | R285: 0 | S285: 1 | T285: 2 | U285: =F285+G285+H285+I285+J285+K285+L285+M285+N285+O285+P285+Q285+R285+S285+T285 -> 41
C286: GRADO EN ADMINISTRACIÓN Y DIRECCIÓN DE EMPRESAS (CEUTA) | E286: Mujer | F286: 7 | G286: 10 | H286: 2 | I286: 3 | J286: 3 | K286: 1 | L286: 0 | M286: 0 | N286: 0 | O286: 0 | P286: 0 | Q286: 0 | R286: 2 | S286: 0 | T286: 0 | U286: =F286+G286+H286+I286+J286+K286+L286+M286+N286+O286+P286+Q286+R286+S286+T286 -> 28
C287: GRADO EN EDUCACIÓN SOCIAL (CEUTA) | D287: =U287+U288 -> 85 | E287: Hombre | F287: 4 | G287: 4 | H287: 2 | I287: 1 | J287: 4 | K287: 2 | L287: 1 | M287: 0 | N287: 0 | O287: 0 | P287: 1 | Q287: 0 | R287: 2 | S287: 2 | T287: 1 | U287: =F287+G287+H287+I287+J287+K287+L287+M287+N287+O287+P287+Q287+R287+S287+T287 -> 24
C288: GRADO EN EDUCACIÓN SOCIAL (CEUTA) | E288: Mujer | F288: 7 | G288: 7 | H288: 8 | I288: 9 | J288: 4 | K288: 7 | L288: 3 | M288: 3 | N288: 0 | O288: 3 | P288: 0 | Q288: 0 | R288: 6 | S288: 1 | T288: 3 | U288: =F288+G288+H288+I288+J288+K288+L288+M288+N288+O288+P288+Q288+R288+S288+T288 -> 61
C289: GRADO EN INGENIERÍA INFORMÁTICA (CEUTA) | D289: =U289+U290 -> 20 | E289: Hombre | F289: 3 | G289: 4 | H289: 2 | I289: 1 | J289: 0 | K289: 0 | L289: 1 | M289: 0 | N289: 0 | O289: 0 | P289: 0 | Q289: 1 | R289: 1 | S289: 2 | T289: 1 | U289: =F289+G289+H289+I289+J289+K289+L289+M289+N289+O289+P289+Q289+R289+S289+T289 -> 16
C290: GRADO EN INGENIERÍA INFORMÁTICA (CEUTA) | E290: Mujer | F290: 1 | G290: 0 | H290: 1 | I290: 0 | J290: 1 | K290: 0 | L290: 1 | M290: 0 | N290: 0 | O290: 0 | P290: 0 | Q290: 0 | R290: 0 | S290: 0 | T290: 0 | U290: =F290+G290+H290+I290+J290+K290+L290+M290+N290+O290+P290+Q290+R290+S290+T290 -> 4
C291: GRADO EN MAESTRO DE EDUCACIÓN INFANTIL (CEUTA) | D291: =U291+U292 -> 90 | E291: Hombre | F291: 1 | G291: 0 | H291: 3 | I291: 3 | J291: 2 | K291: 0 | L291: 0 | M291: 0 | N291: 0 | O291: 0 | P291: 0 | Q291: 0 | R291: 0 | S291: 0 | T291: 0 | U291: =F291+G291+H291+I291+J291+K291+L291+M291+N291+O291+P291+Q291+R291+S291+T291 -> 9
C292: GRADO EN MAESTRO DE EDUCACIÓN INFANTIL (CEUTA) | E292: Mujer | F292: 11 | G292: 17 | H292: 10 | I292: 5 | J292: 7 | K292: 6 | L292: 3 | M292: 4 | N292: 4 | O292: 3 | P292: 2 | Q292: 1 | R292: 4 | S292: 3 | T292: 1 | U292: =F292+G292+H292+I292+J292+K292+L292+M292+N292+O292+P292+Q292+R292+S292+T292 -> 81
C293: GRADO EN MAESTRO EN EDUCACIÓN PRIMARIA (CEUTA) | D293: =U293+U294 -> 152 | E293: Hombre | F293: 17 | G293: 13 | H293: 9 | I293: 8 | J293: 2 | K293: 7 | L293: 6 | M293: 1 | N293: 0 | O293: 0 | P293: 1 | Q293: 1 | R293: 4 | S293: 0 | T293: 2 | U293: =F293+G293+H293+I293+J293+K293+L293+M293+N293+O293+P293+Q293+R293+S293+T293 -> 71
C294: GRADO EN MAESTRO EN EDUCACIÓN PRIMARIA (CEUTA) | E294: Mujer | F294: 19 | G294: 30 | H294: 9 | I294: 4 | J294: 4 | K294: 5 | L294: 4 | M294: 0 | N294: 1 | O294: 1 | P294: 0 | Q294: 1 | R294: 2 | S294: 1 | T294: 0 | U294: =F294+G294+H294+I294+J294+K294+L294+M294+N294+O294+P294+Q294+R294+S294+T294 -> 81
C295: INGENIERO TÉCNICO EN INFORMÁTICA DE GESTIÓN "CEUTA" | D295: =U295+U296 -> 20 | E295: Hombre | F295: 0 | G295: 0 | H295: 2 | I295: 0 | J295: 2 | K295: 1 | L295: 2 | M295: 1 | N295: 2 | O295: 0 | P295: 1 | Q295: 2 | R295: 4 | S295: 0 | T295: 1 | U295: =F295+G295+H295+I295+J295+K295+L295+M295+N295+O295+P295+Q295+R295+S295+T295 -> 18
C296: INGENIERO TÉCNICO EN INFORMÁTICA DE GESTIÓN "CEUTA" | E296: Mujer | F296: 0 | G296: 0 | H296: 0 | I296: 0 | J296: 1 | K296: 0 | L296: 1 | M296: 0 | N296: 0 | O296: 0 | P296: 0 | Q296: 0 | R296: 0 | S296: 0 | T296: 0 | U296: =F296+G296+H296+I296+J296+K296+L296+M296+N296+O296+P296+Q296+R296+S296+T296 -> 2
C297: LICENCIADO EN PSICOPEDAGOGÍA "CEUTA" | D297: =U297+U298 -> 39 | E297: Hombre | F297: 0 | G297: 0 | H297: 0 | I297: 0 | J297: 0 | K297: 3 | L297: 2 | M297: 2 | N297: 0 | O297: 0 | P297: 0 | Q297: 0 | R297: 2 | S297: 2 | T297: 2 | U297: =F297+G297+H297+I297+J297+K297+L297+M297+N297+O297+P297+Q297+R297+S297+T297 -> 13
C298: LICENCIADO EN PSICOPEDAGOGÍA "CEUTA" | E298: Mujer | F298: 0 | G298: 0 | H298: 0 | I298: 0 | J298: 2 | K298: 1 | L298: 4 | M298: 1 | N298: 1 | O298: 1 | P298: 3 | Q298: 1 | R298: 7 | S298: 1 | T298: 4 | U298: =F298+G298+H298+I298+J298+K298+L298+M298+N298+O298+P298+Q298+R298+S298+T298 -> 26
C299: MAESTRO ESPECIALIDAD DE AUDICIÓN Y LENGUAJE "CEUTA" | D299: =U299+U300 -> 9 | E299: Hombre | F299: 0 | G299: 0 | H299: 0 | I299: 0 | J299: 0 | K299: 0 | L299: 0 | M299: 0 | N299: 0 | O299: 0 | P299: 0 | Q299: 0 | R299: 0 | S299: 0 | T299: 1 | U299: =F299+G299+H299+I299+J299+K299+L299+M299+N299+O299+P299+Q299+R299+S299+T299 -> 1
C300: MAESTRO ESPECIALIDAD DE AUDICIÓN Y LENGUAJE "CEUTA" | E300: Mujer | F300: 0 | G300: 0 | H300: 2 | I300: 0 | J300: 0 | K300: 1 | L300: 1 | M300: 0 | N300: 0 | O300: 0 | P300: 0 | Q300: 0 | R300: 2 | S300: 2 | T300: 0 | U300: =F300+G300+H300+I300+J300+K300+L300+M300+N300+O300+P300+Q300+R300+S300+T300 -> 8
C301: MAESTRO ESPECIALIDAD DE EDUCACIÓN ESPECIAL "CEUTA" | D301: =U301+U302 -> 23 | E301: Hombre | F301: 0 | G301: 0 | H301: 1 | I301: 1 | J301: 0 | K301: 0 | L301: 0 | M301: 1 | N301: 0 | O301: 0 | P301: 0 | Q301: 0 | R301: 0 | S301: 0 | T301: 0 | U301: =F301+G301+H301+I301+J301+K301+L301+M301+N301+O301+P301+Q301+R301+S301+T301 -> 3
C302: MAESTRO ESPECIALIDAD DE EDUCACIÓN ESPECIAL "CEUTA" | E302: Mujer | F302: 0 | G302: 0 | H302: 3 | I302: 1 | J302: 1 | K302: 0 | L302: 1 | M302: 1 | N302: 1 | O302: 3 | P302: 1 | Q302: 1 | R302: 3 | S302: 3 | T302: 1 | U302: =F302+G302+H302+I302+J302+K302+L302+M302+N302+O302+P302+Q302+R302+S302+T302 -> 20
C303: MAESTRO ESPECIALIDAD DE EDUCACIÓN FÍSICA "CEUTA" | D303: =U303+U304 -> 71 | E303: Hombre | F303: 0 | G303: 0 | H303: 10 | I303: 8 | J303: 9 | K303: 6 | L303: 7 | M303: 5 | N303: 1 | O303: 0 | P303: 1 | Q303: 1 | R303: 6 | S303: 4 | T303: 2 | U303: =F303+G303+H303+I303+J303+K303+L303+M303+N303+O303+P303+Q303+R303+S303+T303 -> 60
C304: MAESTRO ESPECIALIDAD DE EDUCACIÓN FÍSICA "CEUTA" | E304: Mujer | F304: 0 | G304: 0 | H304: 3 | I304: 0 | J304: 2 | K304: 1 | L304: 1 | M304: 0 | N304: 1 | O304: 0 | P304: 0 | Q304: 0 | R304: 3 | S304: 0 | T304: 0 | U304: =F304+G304+H304+I304+J304+K304+L304+M304+N304+O304+P304+Q304+R304+S304+T304 -> 11
C305: MAESTRO ESPECIALIDAD DE EDUCACIÓN INFANTIL "CEUTA" | D305: =U305+U306 -> 90 | E305: Hombre | F305: 0 | G305: 0 | H305: 0 | I305: 0 | J305: 0 | K305: 0 | L305: 1 | M305: 0 | N305: 1 | O305: 0 | P305: 0 | Q305: 0 | R305: 1 | S305: 1 | T305: 1 | U305: =F305+G305+H305+I305+J305+K305+L305+M305+N305+O305+P305+Q305+R305+S305+T305 -> 5
C306: MAESTRO ESPECIALIDAD DE EDUCACIÓN INFANTIL "CEUTA" | E306: Mujer | F306: 0 | G306: 0 | H306: 19 | I306: 8 | J306: 2 | K306: 4 | L306: 6 | M306: 6 | N306: 7 | O306: 6 | P306: 3 | Q306: 2 | R306: 10 | S306: 9 | T306: 3 | U306: =F306+G306+H306+I306+J306+K306+L306+M306+N306+O306+P306+Q306+R306+S306+T306 -> 85
C307: MAESTRO ESPECIALIDAD DE EDUCACIÓN MUSICAL "CEUTA" | D307: =U307+U308 -> 7 | E307: Hombre | F307: 0 | G307: 0 | H307: 2 | I307: 1 | J307: 0 | K307: 1 | L307: 0 | M307: 0 | N307: 0 | O307: 0 | P307: 0 | Q307: 1 | R307: 0 | S307: 0 | T307: 0 | U307: =F307+G307+H307+I307+J307+K307+L307+M307+N307+O307+P307+Q307+R307+S307+T307 -> 5
C308: MAESTRO ESPECIALIDAD DE EDUCACIÓN MUSICAL "CEUTA" | E308: Mujer | F308: 0 | G308: 0 | H308: 0 | I308: 1 | J308: 0 | K308: 0 | L308: 0 | M308: 0 | N308: 0 | O308: 0 | P308: 0 | Q308: 1 | R308: 0 | S308: 0 | T308: 0 | U308: =F308+G308+H308+I308+J308+K308+L308+M308+N308+O308+P308+Q308+R308+S308+T308 -> 2
C309: MAESTRO ESPECIALIDAD DE EDUCACIÓN PRIMARIA "CEUTA" | D309: =U309+U310 -> 62 | E309: Hombre | F309: 0 | G309: 0 | H309: 5 | I309: 3 | J309: 2 | K309: 2 | L309: 0 | M309: 0 | N309: 1 | O309: 0 | P309: 0 | Q309: 0 | R309: 2 | S309: 3 | T309: 1 | U309: =F309+G309+H309+I309+J309+K309+L309+M309+N309+O309+P309+Q309+R309+S309+T309 -> 19
C310: MAESTRO ESPECIALIDAD DE EDUCACIÓN PRIMARIA "CEUTA" | E310: Mujer | F310: 0 | G310: 0 | H310: 8 | I310: 7 | J310: 4 | K310: 3 | L310: 2 | M310: 3 | N310: 0 | O310: 0 | P310: 1 | Q310: 3 | R310: 4 | S310: 7 | T310: 1 | U310: =F310+G310+H310+I310+J310+K310+L310+M310+N310+O310+P310+Q310+R310+S310+T310 -> 43
C311: MAESTRO ESPECIALIDAD DE LENGUA EXTRANJERA "CEUTA" | D311: =U311+U312 -> 21 | E311: Hombre | F311: 0 | G311: 0 | H311: 0 | I311: 0 | J311: 0 | K311: 0 | L311: 0 | M311: 0 | N311: 1 | O311: 1 | P311: 0 | Q311: 0 | R311: 2 | S311: 1 | T311: 1 | U311: =F311+G311+H311+I311+J311+K311+L311+M311+N311+O311+P311+Q311+R311+S311+T311 -> 6
C312: MAESTRO ESPECIALIDAD DE LENGUA EXTRANJERA "CEUTA" | E312: Mujer | F312: 0 | G312: 0 | H312: 1 | I312: 0 | J312: 0 | K312: 0 | L312: 2 | M312: 1 | N312: 1 | O312: 2 | P312: 1 | Q312: 2 | R312: 2 | S312: 1 | T312: 2 | U312: =F312+G312+H312+I312+J312+K312+L312+M312+N312+O312+P312+Q312+R312+S312+T312 -> 15
A313: FAC. EDUCACION HUMANID.MELILLA | B313: =D313+D315+D317+D319+D321+D323+D325+D327+D329+D331+D333+D335 -> 579 | C313: GRADO EN EDUCACIÓN SOCIAL (MELILLA) | D313: =U313+U314 -> 48 | E313: Hombre | F313: 1 | G313: 2 | H313: 2 | I313: 1 | J313: 0 | K313: 0 | L313: 0 | M313: 1 | N313: 0 | O313: 0 | P313: 0 | Q313: 0 | R313: 2 | S313: 1 | T313: 0 | U313: =F313+G313+H313+I313+J313+K313+L313+M313+N313+O313+P313+Q313+R313+S313+T313 -> 10
C314: GRADO EN EDUCACIÓN SOCIAL (MELILLA) | E314: Mujer | F314: 9 | G314: 6 | H314: 8 | I314: 3 | J314: 6 | K314: 0 | L314: 2 | M314: 2 | N314: 0 | O314: 1 | P314: 0 | Q314: 0 | R314: 0 | S314: 0 | T314: 1 | U314: =F314+G314+H314+I314+J314+K314+L314+M314+N314+O314+P314+Q314+R314+S314+T314 -> 38
C315: GRADO EN MAESTRO DE EDUCACIÓN INFANTIL (MELILLA) | D315: =U315+U316 -> 67 | E315: Hombre | F315: 0 | G315: 2 | H315: 1 | I315: 1 | J315: 1 | K315: 0 | L315: 0 | M315: 0 | N315: 0 | O315: 0 | P315: 0 | Q315: 0 | R315: 1 | S315: 0 | T315: 0 | U315: =F315+G315+H315+I315+J315+K315+L315+M315+N315+O315+P315+Q315+R315+S315+T315 -> 6
C316: GRADO EN MAESTRO DE EDUCACIÓN INFANTIL (MELILLA) | E316: Mujer | F316: 9 | G316: 18 | H316: 7 | I316: 7 | J316: 2 | K316: 4 | L316: 3 | M316: 1 | N316: 1 | O316: 2 | P316: 1 | Q316: 1 | R316: 2 | S316: 3 | T316: 0 | U316: =F316+G316+H316+I316+J316+K316+L316+M316+N316+O316+P316+Q316+R316+S316+T316 -> 61
C317: GRADO EN MAESTRO EN EDUCACIÓN PRIMARIA (MELILLA) | D317: =U317+U318 -> 127 | E317: Hombre | F317: 17 | G317: 11 | H317: 7 | I317: 7 | J317: 0 | K317: 1 | L317: 0 | M317: 1 | N317: 1 | O317: 1 | P317: 0 | Q317: 0 | R317: 1 | S317: 3 | T317: 1 | U317: =F317+G317+H317+I317+J317+K317+L317+M317+N317+O317+P317+Q317+R317+S317+T317 -> 51
C318: GRADO EN MAESTRO EN EDUCACIÓN PRIMARIA (MELILLA) | E318: Mujer | F318: 17 | G318: 33 | H318: 6 | I318: 5 | J318: 4 | K318: 2 | L318: 0 | M318: 2 | N318: 1 | O318: 0 | P318: 0 | Q318: 1 | R318: 1 | S318: 1 | T318: 3 | U318: =F318+G318+H318+I318+J318+K318+L318+M318+N318+O318+P318+Q318+R318+S318+T318 -> 76
C319: LICENCIADO EN PSICOPEDAGOGÍA "MELILLA" | D319: =U319+U320 -> 82 | E319: Hombre | F319: 0 | G319: 0 | H319: 0 | I319: 1 | J319: 2 | K319: 4 | L319: 4 | M319: 3 | N319: 0 | O319: 2 | P319: 1 | Q319: 1 | R319: 3 | S319: 0 | T319: 1 | U319: =F319+G319+H319+I319+J319+K319+L319+M319+N319+O319+P319+Q319+R319+S319+T319 -> 22
C320: LICENCIADO EN PSICOPEDAGOGÍA "MELILLA" | E320: Mujer | F320: 0 | G320: 0 | H320: 0 | I320: 3 | J320: 7 | K320: 12 | L320: 8 | M320: 4 | N320: 2 | O320: 0 | P320: 5 | Q320: 2 | R320: 7 | S320: 6 | T320: 4 | U320: =F320+G320+H320+I320+J320+K320+L320+M320+N320+O320+P320+Q320+R320+S320+T320 -> 60
C321: MAESTRO (ESPECIALIDAD DE EDUCACIÓN INFANTIL) "MELILLA" | D321: =U321+U322 -> 1 | E321: Hombre | F321: 0 | G321: 0 | H321: 0 | I321: 0 | J321: 0 | K321: 0 | L321: 0 | M321: 0 | N321: 0 | O321: 0 | P321: 0 | Q321: 0 | R321: 0 | S321: 0 | T321: 0 | U321: =F321+G321+H321+I321+J321+K321+L321+M321+N321+O321+P321+Q321+R321+S321+T321 -> 0
C322: MAESTRO (ESPECIALIDAD DE EDUCACIÓN INFANTIL) "MELILLA" | E322: Mujer | F322: 0 | G322: 0 | H322: 0 | I322: 0 | J322: 0 | K322: 0 | L322: 0 | M322: 0 | N322: 0 | O322: 0 | P322: 0 | Q322: 0 | R322: 0 | S322: 1 | T322: 0 | U322: =F322+G322+H322+I322+J322+K322+L322+M322+N322+O322+P322+Q322+R322+S322+T322 -> 1
C323: MAESTRO ESPECIALIDAD DE AUDICIÓN Y LENGUAJE "MELILLA" | D323: =U323+U324 -> 9 | E323: Hombre | F323: 0 | G323: 0 | H323: 0 | I323: 0 | J323: 0 | K323: 0 | L323: 0 | M323: 0 | N323: 0 | O323: 0 | P323: 0 | Q323: 0 | R323: 1 | S323: 0 | T323: 0 | U323: =F323+G323+H323+I323+J323+K323+L323+M323+N323+O323+P323+Q323+R323+S323+T323 -> 1
C324: MAESTRO ESPECIALIDAD DE AUDICIÓN Y LENGUAJE "MELILLA" | E324: Mujer | F324: 0 | G324: 0 | H324: 1 | I324: 0 | J324: 1 | K324: 1 | L324: 1 | M324: 2 | N324: 1 | O324: 0 | P324: 0 | Q324: 0 | R324: 1 | S324: 0 | T324: 0 | U324: =F324+G324+H324+I324+J324+K324+L324+M324+N324+O324+P324+Q324+R324+S324+T324 -> 8
C325: MAESTRO ESPECIALIDAD DE EDUCACIÓN ESPECIAL "MELILLA" | D325: =U325+U326 -> 19 | E325: Hombre | F325: 0 | G325: 0 | H325: 0 | I325: 0 | J325: 1 | K325: 0 | L325: 0 | M325: 0 | N325: 0 | O325: 0 | P325: 0 | Q325: 0 | R325: 0 | S325: 0 | T325: 0 | U325: =F325+G325+H325+I325+J325+K325+L325+M325+N325+O325+P325+Q325+R325+S325+T325 -> 1
C326: MAESTRO ESPECIALIDAD DE EDUCACIÓN ESPECIAL "MELILLA" | E326: Mujer | F326: 0 | G326: 0 | H326: 1 | I326: 0 | J326: 2 | K326: 3 | L326: 0 | M326: 1 | N326: 3 | O326: 0 | P326: 1 | Q326: 2 | R326: 5 | S326: 0 | T326: 0 | U326: =F326+G326+H326+I326+J326+K326+L326+M326+N326+O326+P326+Q326+R326+S326+T326 -> 18
C327: MAESTRO ESPECIALIDAD DE EDUCACIÓN FÍSICA "MELILLA" | D327: =U327+U328 -> 48 | E327: Hombre | F327: 0 | G327: 0 | H327: 5 | I327: 6 | J327: 5 | K327: 5 | L327: 6 | M327: 1 | N327: 1 | O327: 1 | P327: 1 | Q327: 1 | R327: 2 | S327: 1 | T327: 2 | U327: =F327+G327+H327+I327+J327+K327+L327+M327+N327+O327+P327+Q327+R327+S327+T327 -> 37
C328: MAESTRO ESPECIALIDAD DE EDUCACIÓN FÍSICA "MELILLA" | E328: Mujer | F328: 0 | G328: 0 | H328: 3 | I328: 1 | J328: 2 | K328: 1 | L328: 2 | M328: 1 | N328: 0 | O328: 0 | P328: 0 | Q328: 0 | R328: 1 | S328: 0 | T328: 0 | U328: =F328+G328+H328+I328+J328+K328+L328+M328+N328+O328+P328+Q328+R328+S328+T328 -> 11
C329: MAESTRO ESPECIALIDAD DE EDUCACIÓN INFANTIL "MELILLA" | D329: =U329+U330 -> 58 | E329: Hombre | F329: 0 | G329: 0 | H329: 0 | I329: 0 | J329: 0 | K329: 1 | L329: 0 | M329: 0 | N329: 0 | O329: 0 | P329: 0 | Q329: 0 | R329: 0 | S329: 0 | T329: 1 | U329: =F329+G329+H329+I329+J329+K329+L329+M329+N329+O329+P329+Q329+R329+S329+T329 -> 2
C330: MAESTRO ESPECIALIDAD DE EDUCACIÓN INFANTIL "MELILLA" | E330: Mujer | F330: 0 | G330: 0 | H330: 5 | I330: 7 | J330: 4 | K330: 8 | L330: 6 | M330: 3 | N330: 9 | O330: 2 | P330: 0 | Q330: 3 | R330: 4 | S330: 3 | T330: 2 | U330: =F330+G330+H330+I330+J330+K330+L330+M330+N330+O330+P330+Q330+R330+S330+T330 -> 56
C331: MAESTRO ESPECIALIDAD DE EDUCACIÓN MUSICAL "MELILLA" | D331: =U331+U332 -> 7 | E331: Hombre | F331: 0 | G331: 0 | H331: 1 | I331: 0 | J331: 0 | K331: 0 | L331: 0 | M331: 0 | N331: 0 | O331: 0 | P331: 0 | Q331: 0 | R331: 1 | S331: 0 | T331: 0 | U331: =F331+G331+H331+I331+J331+K331+L331+M331+N331+O331+P331+Q331+R331+S331+T331 -> 2
C332: MAESTRO ESPECIALIDAD DE EDUCACIÓN MUSICAL "MELILLA" | E332: Mujer | F332: 0 | G332: 0 | H332: 0 | I332: 1 | J332: 2 | K332: 0 | L332: 1 | M332: 1 | N332: 0 | O332: 0 | P332: 0 | Q332: 0 | R332: 0 | S332: 0 | T332: 0 | U332: =F332+G332+H332+I332+J332+K332+L332+M332+N332+O332+P332+Q332+R332+S332+T332 -> 5
C333: MAESTRO ESPECIALIDAD DE EDUCACIÓN PRIMARIA "MELILLA" | D333: =U333+U334 -> 86 | E333: Hombre | F333: 0 | G333: 0 | H333: 3 | I333: 5 | J333: 3 | K333: 4 | L333: 1 | M333: 0 | N333: 0 | O333: 0 | P333: 0 | Q333: 0 | R333: 1 | S333: 2 | T333: 5 | U333: =F333+G333+H333+I333+J333+K333+L333+M333+N333+O333+P333+Q333+R333+S333+T333 -> 24
C334: MAESTRO ESPECIALIDAD DE EDUCACIÓN PRIMARIA "MELILLA" | E334: Mujer | F334: 0 | G334: 0 | H334: 10 | I334: 12 | J334: 10 | K334: 4 | L334: 4 | M334: 3 | N334: 1 | O334: 2 | P334: 1 | Q334: 3 | R334: 7 | S334: 1 | T334: 4 | U334: =F334+G334+H334+I334+J334+K334+L334+M334+N334+O334+P334+Q334+R334+S334+T334 -> 62
C335: MAESTRO ESPECIALIDAD DE LENGUA EXTRANJERA "MELILLA" | D335: =U335+U336 -> 27 | E335: Hombre | F335: 0 | G335: 0 | H335: 0 | I335: 0 | J335: 0 | K335: 0 | L335: 0 | M335: 1 | N335: 1 | O335: 0 | P335: 0 | Q335: 2 | R335: 2 | S335: 1 | T335: 0 | U335: =F335+G335+H335+I335+J335+K335+L335+M335+N335+O335+P335+Q335+R335+S335+T335 -> 7
C336: MAESTRO ESPECIALIDAD DE LENGUA EXTRANJERA "MELILLA" | E336: Mujer | F336: 0 | G336: 0 | H336: 3 | I336: 1 | J336: 0 | K336: 2 | L336: 0 | M336: 3 | N336: 5 | O336: 0 | P336: 3 | Q336: 1 | R336: 0 | S336: 1 | T336: 1 | U336: =F336+G336+H336+I336+J336+K336+L336+M336+N336+O336+P336+Q336+R336+S336+T336 -> 20
A337: F. CC SOCIALES DE MELILLA | B337: =D337+D339+D341+D343+D345+D347 -> 250 | C337: DIPLOMADO EN CIENCIAS EMPRESARIALES "MELILLA" | D337: =U337+U338 -> 97 | E337: Hombre | F337: 0 | G337: 0 | H337: 3 | I337: 1 | J337: 9 | K337: 4 | L337: 6 | M337: 4 | N337: 2 | O337: 1 | P337: 1 | Q337: 3 | R337: 3 | S337: 2 | T337: 1 | U337: =F337+G337+H337+I337+J337+K337+L337+M337+N337+O337+P337+Q337+R337+S337+T337 -> 40
C338: DIPLOMADO EN CIENCIAS EMPRESARIALES "MELILLA" | E338: Mujer | F338: 0 | G338: 0 | H338: 8 | I338: 10 | J338: 9 | K338: 5 | L338: 6 | M338: 1 | N338: 2 | O338: 3 | P338: 1 | Q338: 0 | R338: 10 | S338: 2 | T338: 0 | U338: =F338+G338+H338+I338+J338+K338+L338+M338+N338+O338+P338+Q338+R338+S338+T338 -> 57
C339: DIPLOMADO EN GESTIÓN Y ADMINISTRACIÓN PÚBLICA "MELILLA" | D339: =U339+U340 -> 17 | E339: Hombre | F339: 0 | G339: 0 | H339: 0 | I339: 0 | J339: 1 | K339: 1 | L339: 0 | M339: 1 | N339: 0 | O339: 1 | P339: 1 | Q339: 0 | R339: 1 | S339: 1 | T339: 3 | U339: =F339+G339+H339+I339+J339+K339+L339+M339+N339+O339+P339+Q339+R339+S339+T339 -> 10
C340: DIPLOMADO EN GESTIÓN Y ADMINISTRACIÓN PÚBLICA "MELILLA" | E340: Mujer | F340: 0 | G340: 0 | H340: 0 | I340: 2 | J340: 0 | K340: 0 | L340: 0 | M340: 0 | N340: 1 | O340: 0 | P340: 2 | Q340: 0 | R340: 0 | S340: 1 | T340: 1 | U340: =F340+G340+H340+I340+J340+K340+L340+M340+N340+O340+P340+Q340+R340+S340+T340 -> 7
C341: DIPLOMADO EN RELACIONES LABORALES "MELILLA" | D341: =U341+U342 -> 23 | E341: Hombre | F341: 0 | G341: 0 | H341: 1 | I341: 1 | J341: 0 | K341: 0 | L341: 0 | M341: 0 | N341: 1 | O341: 0 | P341: 0 | Q341: 0 | R341: 0 | S341: 2 | T341: 3 | U341: =F341+G341+H341+I341+J341+K341+L341+M341+N341+O341+P341+Q341+R341+S341+T341 -> 8
C342: DIPLOMADO EN RELACIONES LABORALES "MELILLA" | E342: Mujer | F342: 0 | G342: 0 | H342: 1 | I342: 3 | J342: 1 | K342: 0 | L342: 1 | M342: 1 | N342: 3 | O342: 0 | P342: 0 | Q342: 0 | R342: 0 | S342: 1 | T342: 4 | U342: =F342+G342+H342+I342+J342+K342+L342+M342+N342+O342+P342+Q342+R342+S342+T342 -> 15
C343: GRADO EN ADMINISTRACIÓN Y DIRECCIÓN DE EMPRESAS (MELILLA) | D343: =U343+U344 -> 82 | E343: Hombre | F343: 11 | G343: 13 | H343: 8 | I343: 7 | J343: 3 | K343: 0 | L343: 2 | M343: 0 | N343: 0 | O343: 0 | P343: 0 | Q343: 0 | R343: 0 | S343: 1 | T343: 1 | U343: =F343+G343+H343+I343+J343+K343+L343+M343+N343+O343+P343+Q343+R343+S343+T343 -> 46
C344: GRADO EN ADMINISTRACIÓN Y DIRECCIÓN DE EMPRESAS (MELILLA) | E344: Mujer | F344: 8 | G344: 14 | H344: 5 | I344: 0 | J344: 3 | K344: 1 | L344: 1 | M344: 1 | N344: 1 | O344: 0 | P344: 2 | Q344: 0 | R344: 0 | S344: 0 | T344: 0 | U344: =F344+G344+H344+I344+J344+K344+L344+M344+N344+O344+P344+Q344+R344+S344+T344 -> 36
C345: GRADO EN GESTIÓN Y ADMINISTRACIÓN PÚBLICA (MELILLA) | D345: =U345+U346 -> 14 | E345: Hombre | F345: 0 | G345: 1 | H345: 1 | I345: 1 | J345: 0 | K345: 1 | L345: 0 | M345: 1 | N345: 0 | O345: 0 | P345: 0 | Q345: 0 | R345: 0 | S345: 0 | T345: 1 | U345: =F345+G345+H345+I345+J345+K345+L345+M345+N345+O345+P345+Q345+R345+S345+T345 -> 6
C346: GRADO EN GESTIÓN Y ADMINISTRACIÓN PÚBLICA (MELILLA) | E346: Mujer | F346: 4 | G346: 2 | H346: 0 | I346: 0 | J346: 0 | K346: 0 | L346: 0 | M346: 0 | N346: 0 | O346: 0 | P346: 0 | Q346: 0 | R346: 0 | S346: 0 | T346: 2 | U346: =F346+G346+H346+I346+J346+K346+L346+M346+N346+O346+P346+Q346+R346+S346+T346 -> 8
C347: GRADO EN RELACIONES LABORALES Y RECURSOS HUMANOS (MELILLA) | D347: =U347+U348 -> 17 | E347: Hombre | F347: 1 | G347: 2 | H347: 0 | I347: 0 | J347: 0 | K347: 1 | L347: 0 | M347: 0 | N347: 0 | O347: 0 | P347: 0 | Q347: 0 | R347: 1 | S347: 0 | T347: 1 | U347: =F347+G347+H347+I347+J347+K347+L347+M347+N347+O347+P347+Q347+R347+S347+T347 -> 6
C348: GRADO EN RELACIONES LABORALES Y RECURSOS HUMANOS (MELILLA) | E348: Mujer | F348: 1 | G348: 6 | H348: 0 | I348: 1 | J348: 1 | K348: 0 | L348: 1 | M348: 0 | N348: 0 | O348: 0 | P348: 0 | Q348: 0 | R348: 1 | S348: 0 | T348: 0 | U348: =F348+G348+H348+I348+J348+K348+L348+M348+N348+O348+P348+Q348+R348+S348+T348 -> 11
A349: F. DE ENFERMERÍA DE MELILLA | B349: =D349+D351 -> 221 | C349: DIPLOMADO EN ENFERMERÍA "MELILLA" | D349: =U349+U350 -> 97 | E349: Hombre | F349: 0 | G349: 0 | H349: 3 | I349: 4 | J349: 2 | K349: 2 | L349: 0 | M349: 2 | N349: 1 | O349: 2 | P349: 0 | Q349: 0 | R349: 0 | S349: 2 | T349: 1 | U349: =F349+G349+H349+I349+J349+K349+L349+M349+N349+O349+P349+Q349+R349+S349+T349 -> 19
C350: DIPLOMADO EN ENFERMERÍA "MELILLA" | E350: Mujer | F350: 0 | G350: 0 | H350: 23 | I350: 16 | J350: 6 | K350: 8 | L350: 3 | M350: 3 | N350: 3 | O350: 0 | P350: 4 | Q350: 1 | R350: 4 | S350: 3 | T350: 4 | U350: =F350+G350+H350+I350+J350+K350+L350+M350+N350+O350+P350+Q350+R350+S350+T350 -> 78
C351: GRADO EN ENFERMERÍA (MELILLA) | D351: =U351+U352 -> 124 | E351: Hombre | F351: 9 | G351: 3 | H351: 7 | I351: 1 | J351: 0 | K351: 4 | L351: 0 | M351: 4 | N351: 1 | O351: 0 | P351: 0 | Q351: 0 | R351: 0 | S351: 1 | T351: 0 | U351: =F351+G351+H351+I351+J351+K351+L351+M351+N351+O351+P351+Q351+R351+S351+T351 -> 30
C352: GRADO EN ENFERMERÍA (MELILLA) | E352: Mujer | F352: 18 | G352: 11 | H352: 6 | I352: 13 | J352: 7 | K352: 10 | L352: 5 | M352: 1 | N352: 5 | O352: 3 | P352: 2 | Q352: 1 | R352: 4 | S352: 4 | T352: 4 | U352: =F352+G352+H352+I352+J352+K352+L352+M352+N352+O352+P352+Q352+R352+S352+T352 -> 94
A353: F. DE CC. DE LA SALUD CEUTA | B353: =D353+D355 -> 525 | C353: DIPLOMADO EN ENFERMERÍA "CEUTA" | D353: =U353+U354 -> 266 | E353: Hombre | F353: 0 | G353: 0 | H353: 13 | I353: 21 | J353: 8 | K353: 6 | L353: 6 | M353: 2 | N353: 2 | O353: 4 | P353: 3 | Q353: 1 | R353: 5 | S353: 4 | T353: 3 | U353: =F353+G353+H353+I353+J353+K353+L353+M353+N353+O353+P353+Q353+R353+S353+T353 -> 78
C354: DIPLOMADO EN ENFERMERÍA "CEUTA" | E354: Mujer | F354: 0 | G354: 0 | H354: 24 | I354: 25 | J354: 24 | K354: 24 | L354: 13 | M354: 12 | N354: 17 | O354: 6 | P354: 9 | Q354: 4 | R354: 11 | S354: 7 | T354: 12 | U354: =F354+G354+H354+I354+J354+K354+L354+M354+N354+O354+P354+Q354+R354+S354+T354 -> 188
C355: GRADO EN ENFERMERÍA (CEUTA) | D355: =U355+U356 -> 259 | E355: Hombre | F355: 15 | G355: 8 | H355: 6 | I355: 15 | J355: 4 | K355: 7 | L355: 1 | M355: 2 | N355: 2 | O355: 2 | P355: 4 | Q355: 1 | R355: 4 | S355: 0 | T355: 3 | U355: =F355+G355+H355+I355+J355+K355+L355+M355+N355+O355+P355+Q355+R355+S355+T355 -> 74
C356: GRADO EN ENFERMERÍA (CEUTA) | E356: Mujer | F356: 32 | G356: 34 | H356: 23 | I356: 21 | J356: 29 | K356: 10 | L356: 9 | M356: 6 | N356: 6 | O356: 3 | P356: 2 | Q356: 2 | R356: 3 | S356: 3 | T356: 2 | U356: =F356+G356+H356+I356+J356+K356+L356+M356+N356+O356+P356+Q356+R356+S356+T356 -> 185
A357: CENTRO PROF. INMACULADAC CONC. | B357: =D357+D359+D361+D363+D365+D367+D369+D371+D373 -> 1313 | C357: GRADO EN MAESTRO DE EDUCACIÓN INFANTIL (LA INMACULADA) | D357: =U357+U358 -> 280 | E357: Hombre | F357: 3 | G357: 9 | H357: 3 | I357: 4 | J357: 4 | K357: 0 | L357: 0 | M357: 1 | N357: 0 | O357: 0 | P357: 0 | Q357: 0 | R357: 2 | S357: 1 | T357: 0 | U357: =F357+G357+H357+I357+J357+K357+L357+M357+N357+O357+P357+Q357+R357+S357+T357 -> 27
C358: GRADO EN MAESTRO DE EDUCACIÓN INFANTIL (LA INMACULADA) | E358: Mujer | F358: 44 | G358: 73 | H358: 47 | I358: 33 | J358: 14 | K358: 13 | L358: 7 | M358: 2 | N358: 4 | O358: 1 | P358: 3 | Q358: 4 | R358: 4 | S358: 1 | T358: 3 | U358: =F358+G358+H358+I358+J358+K358+L358+M358+N358+O358+P358+Q358+R358+S358+T358 -> 253
C359: GRADO EN MAESTRO EN EDUCACIÓN PRIMARIA (LA INMACULADA) | D359: =U359+U360 -> 458 | E359: Hombre | F359: 39 | G359: 56 | H359: 53 | I359: 25 | J359: 14 | K359: 7 | L359: 7 | M359: 3 | N359: 5 | O359: 2 | P359: 0 | Q359: 0 | R359: 8 | S359: 3 | T359: 1 | U359: =F359+G359+H359+I359+J359+K359+L359+M359+N359+O359+P359+Q359+R359+S359+T359 -> 223
C360: GRADO EN MAESTRO EN EDUCACIÓN PRIMARIA (LA INMACULADA) | E360: Mujer | F360: 40 | G360: 76 | H360: 45 | I360: 26 | J360: 13 | K360: 13 | L360: 3 | M360: 4 | N360: 2 | O360: 1 | P360: 1 | Q360: 1 | R360: 3 | S360: 5 | T360: 2 | U360: =F360+G360+H360+I360+J360+K360+L360+M360+N360+O360+P360+Q360+R360+S360+T360 -> 235
C361: MAESTRO ESPECIALIDAD DE AUDICIÓN Y LENGUAJE (LA INMACULADA) | D361: =U361+U362 -> 33 | E361: Hombre | F361: 0 | G361: 0 | H361: 1 | I361: 2 | J361: 2 | K361: 3 | L361: 0 | M361: 0 | N361: 1 | O361: 0 | P361: 0 | Q361: 0 | R361: 0 | S361: 0 | T361: 0 | U361: =F361+G361+H361+I361+J361+K361+L361+M361+N361+O361+P361+Q361+R361+S361+T361 -> 9
C362: MAESTRO ESPECIALIDAD DE AUDICIÓN Y LENGUAJE (LA INMACULADA) | E362: Mujer | F362: 0 | G362: 0 | H362: 11 | I362: 7 | J362: 2 | K362: 1 | L362: 1 | M362: 0 | N362: 0 | O362: 0 | P362: 0 | Q362: 0 | R362: 1 | S362: 0 | T362: 1 | U362: =F362+G362+H362+I362+J362+K362+L362+M362+N362+O362+P362+Q362+R362+S362+T362 -> 24
C363: MAESTRO ESPECIALIDAD DE EDUCACIÓN ESPECIAL (LA INMACULADA) | D363: =U363+U364 -> 57 | E363: Hombre | F363: 0 | G363: 0 | H363: 8 | I363: 2 | J363: 1 | K363: 0 | L363: 1 | M363: 1 | N363: 0 | O363: 1 | P363: 1 | Q363: 1 | R363: 0 | S363: 0 | T363: 0 | U363: =F363+G363+H363+I363+J363+K363+L363+M363+N363+O363+P363+Q363+R363+S363+T363 -> 16
C364: MAESTRO ESPECIALIDAD DE EDUCACIÓN ESPECIAL (LA INMACULADA) | E364: Mujer | F364: 0 | G364: 0 | H364: 11 | I364: 12 | J364: 4 | K364: 5 | L364: 3 | M364: 1 | N364: 1 | O364: 2 | P364: 1 | Q364: 0 | R364: 1 | S364: 0 | T364: 0 | U364: =F364+G364+H364+I364+J364+K364+L364+M364+N364+O364+P364+Q364+R364+S364+T364 -> 41
C365: MAESTRO ESPECIALIDAD DE EDUCACIÓN FÍSICA (LA INMACULADA) | D365: =U365+U366 -> 156 | E365: Hombre | F365: 0 | G365: 0 | H365: 25 | I365: 26 | J365: 13 | K365: 17 | L365: 8 | M365: 14 | N365: 6 | O365: 2 | P365: 4 | Q365: 4 | R365: 4 | S365: 2 | T365: 0 | U365: =F365+G365+H365+I365+J365+K365+L365+M365+N365+O365+P365+Q365+R365+S365+T365 -> 125
C366: MAESTRO ESPECIALIDAD DE EDUCACIÓN FÍSICA (LA INMACULADA) | E366: Mujer | F366: 0 | G366: 0 | H366: 14 | I366: 3 | J366: 6 | K366: 2 | L366: 1 | M366: 2 | N366: 0 | O366: 0 | P366: 0 | Q366: 1 | R366: 2 | S366: 0 | T366: 0 | U366: =F366+G366+H366+I366+J366+K366+L366+M366+N366+O366+P366+Q366+R366+S366+T366 -> 31
C367: MAESTRO ESPECIALIDAD DE EDUCACIÓN INFANTIL (LA INMACULADA) | D367: =U367+U368 -> 133 | E367: Hombre | F367: 0 | G367: 0 | H367: 5 | I367: 1 | J367: 2 | K367: 0 | L367: 0 | M367: 2 | N367: 1 | O367: 0 | P367: 0 | Q367: 1 | R367: 1 | S367: 2 | T367: 1 | U367: =F367+G367+H367+I367+J367+K367+L367+M367+N367+O367+P367+Q367+R367+S367+T367 -> 16
C368: MAESTRO ESPECIALIDAD DE EDUCACIÓN INFANTIL (LA INMACULADA) | E368: Mujer | F368: 0 | G368: 0 | H368: 22 | I368: 20 | J368: 15 | K368: 11 | L368: 10 | M368: 11 | N368: 4 | O368: 2 | P368: 2 | Q368: 0 | R368: 11 | S368: 6 | T368: 3 | U368: =F368+G368+H368+I368+J368+K368+L368+M368+N368+O368+P368+Q368+R368+S368+T368 -> 117
C369: MAESTRO ESPECIALIDAD DE EDUCACIÓN MUSICAL (LA INMACULADA) | D369: =U369+U370 -> 49 | E369: Hombre | F369: 0 | G369: 0 | H369: 7 | I369: 6 | J369: 1 | K369: 0 | L369: 1 | M369: 1 | N369: 0 | O369: 3 | P369: 2 | Q369: 2 | R369: 0 | S369: 1 | T369: 0 | U369: =F369+G369+H369+I369+J369+K369+L369+M369+N369+O369+P369+Q369+R369+S369+T369 -> 24
C370: MAESTRO ESPECIALIDAD DE EDUCACIÓN MUSICAL (LA INMACULADA) | E370: Mujer | F370: 0 | G370: 0 | H370: 7 | I370: 4 | J370: 4 | K370: 1 | L370: 1 | M370: 0 | N370: 1 | O370: 0 | P370: 1 | Q370: 0 | R370: 5 | S370: 1 | T370: 0 | U370: =F370+G370+H370+I370+J370+K370+L370+M370+N370+O370+P370+Q370+R370+S370+T370 -> 25
C371: MAESTRO ESPECIALIDAD DE EDUCACIÓN PRIMARIA (LA INMACULADA) | D371: =U371+U372 -> 103 | E371: Hombre | F371: 0 | G371: 0 | H371: 0 | I371: 13 | J371: 5 | K371: 5 | L371: 4 | M371: 1 | N371: 1 | O371: 1 | P371: 1 | Q371: 1 | R371: 1 | S371: 1 | T371: 1 | U371: =F371+G371+H371+I371+J371+K371+L371+M371+N371+O371+P371+Q371+R371+S371+T371 -> 35
C372: MAESTRO ESPECIALIDAD DE EDUCACIÓN PRIMARIA (LA INMACULADA) | E372: Mujer | F372: 0 | G372: 0 | H372: 14 | I372: 18 | J372: 11 | K372: 5 | L372: 5 | M372: 5 | N372: 1 | O372: 3 | P372: 1 | Q372: 2 | R372: 3 | S372: 0 | T372: 0 | U372: =F372+G372+H372+I372+J372+K372+L372+M372+N372+O372+P372+Q372+R372+S372+T372 -> 68
C373: MAESTRO ESPECIALIDAD DE LENGUA EXTRANJERA (LA INMACULADA) | D373: =U373+U374 -> 44 | E373: Hombre | F373: 0 | G373: 0 | H373: 0 | I373: 0 | J373: 1 | K373: 5 | L373: 1 | M373: 2 | N373: 1 | O373: 0 | P373: 1 | Q373: 1 | R373: 1 | S373: 0 | T373: 0 | U373: =F373+G373+H373+I373+J373+K373+L373+M373+N373+O373+P373+Q373+R373+S373+T373 -> 13
C374: MAESTRO ESPECIALIDAD DE LENGUA EXTRANJERA (LA INMACULADA) | E374: Mujer | F374: 0 | G374: 0 | H374: 3 | I374: 6 | J374: 4 | K374: 2 | L374: 0 | M374: 1 | N374: 4 | O374: 1 | P374: 3 | Q374: 1 | R374: 2 | S374: 2 | T374: 2 | U374: =F374+G374+H374+I374+J374+K374+L374+M374+N374+O374+P374+Q374+R374+S374+T374 -> 31
A375: CENTRO DE ENFERMERÍA DEL S.A.S | B375: =D375+D377 -> 182 | C375: DIPLOMADO EN ENFERMERÍA (VIRGEN DE LAS NIEVES) | D375: =U375+U376 -> 69 | E375: Hombre | F375: 0 | G375: 0 | H375: 7 | I375: 2 | J375: 2 | K375: 1 | L375: 2 | M375: 0 | N375: 1 | O375: 1 | P375: 0 | Q375: 1 | R375: 5 | S375: 2 | T375: 1 | U375: =F375+G375+H375+I375+J375+K375+L375+M375+N375+O375+P375+Q375+R375+S375+T375 -> 25
C376: DIPLOMADO EN ENFERMERÍA (VIRGEN DE LAS NIEVES) | E376: Mujer | F376: 0 | G376: 0 | H376: 24 | I376: 1 | J376: 3 | K376: 5 | L376: 2 | M376: 2 | N376: 1 | O376: 0 | P376: 1 | Q376: 0 | R376: 2 | S376: 0 | T376: 3 | U376: =F376+G376+H376+I376+J376+K376+L376+M376+N376+O376+P376+Q376+R376+S376+T376 -> 44
C377: GRADO EN ENFERMERÍA (VIRGEN DE LA NIEVES) | D377: =U377+U378 -> 113 | E377: Hombre | F377: 5 | G377: 5 | H377: 3 | I377: 3 | J377: 1 | K377: 1 | L377: 2 | M377: 0 | N377: 0 | O377: 1 | P377: 2 | Q377: 0 | R377: 1 | S377: 0 | T377: 2 | U377: =F377+G377+H377+I377+J377+K377+L377+M377+N377+O377+P377+Q377+R377+S377+T377 -> 26
C378: GRADO EN ENFERMERÍA (VIRGEN DE LA NIEVES) | E378: Mujer | F378: 17 | G378: 15 | H378: 9 | I378: 14 | J378: 8 | K378: 3 | L378: 2 | M378: 1 | N378: 5 | O378: 1 | P378: 2 | Q378: 1 | R378: 3 | S378: 0 | T378: 6 | U378: =F378+G378+H378+I378+J378+K378+L378+M378+N378+O378+P378+Q378+R378+S378+T378 -> 87
A379: FACS. EMPRESARIALES Y DERECHO | B379: =D379+D381 -> 860 | C379: GRADO EN ADMINISTRACIÓN Y DIRECCIÓN DE EMPRESAS Y DERECHO | D379: =U379+U380 -> 271 | E379: Hombre | F379: 44 | G379: 52 | H379: 5 | I379: 0 | J379: 0 | K379: 0 | L379: 0 | M379: 0 | N379: 0 | O379: 0 | P379: 0 | Q379: 0 | R379: 1 | S379: 1 | T379: 1 | U379: =F379+G379+H379+I379+J379+K379+L379+M379+N379+O379+P379+Q379+R379+S379+T379 -> 104
C380: GRADO EN ADMINISTRACIÓN Y DIRECCIÓN DE EMPRESAS Y DERECHO | E380: Mujer | F380: 81 | G380: 73 | H380: 7 | I380: 3 | J380: 0 | K380: 0 | L380: 0 | M380: 0 | N380: 0 | O380: 0 | P380: 1 | Q380: 0 | R380: 0 | S380: 0 | T380: 2 | U380: =F380+G380+H380+I380+J380+K380+L380+M380+N380+O380+P380+Q380+R380+S380+T380 -> 167
C381: LDO. EN ADMINISTRACIÓN Y DIRECCIÓN DE EMPRESAS Y DERECHO | D381: =U381+U382 -> 589 | E381: Hombre | F381: 0 | G381: 0 | H381: 34 | I381: 39 | J381: 43 | K381: 34 | L381: 22 | M381: 14 | N381: 6 | O381: 8 | P381: 2 | Q381: 1 | R381: 0 | S381: 0 | T381: 0 | U381: =F381+G381+H381+I381+J381+K381+L381+M381+N381+O381+P381+Q381+R381+S381+T381 -> 203
C382: LDO. EN ADMINISTRACIÓN Y DIRECCIÓN DE EMPRESAS Y DERECHO | E382: Mujer | F382: 0 | G382: 0 | H382: 75 | I382: 84 | J382: 60 | K382: 79 | L382: 39 | M382: 19 | N382: 18 | O382: 8 | P382: 3 | Q382: 0 | R382: 0 | S382: 1 | T382: 0 | U382: =F382+G382+H382+I382+J382+K382+L382+M382+N382+O382+P382+Q382+R382+S382+T382 -> 386
A383: FACS. CC. POLÍTICAS Y DERECHO | B383: =D383+D385 -> 508 | C383: GRADO EN CIENCIAS POLÍTICAS Y DE LA ADMINISTRACIÓN Y DERECHO | D383: =U383+U384 -> 222 | E383: Hombre | F383: 43 | G383: 29 | H383: 11 | I383: 6 | J383: 7 | K383: 2 | L383: 3 | M383: 1 | N383: 0 | O383: 1 | P383: 0 | Q383: 0 | R383: 0 | S383: 0 | T383: 2 | U383: =F383+G383+H383+I383+J383+K383+L383+M383+N383+O383+P383+Q383+R383+S383+T383 -> 105
C384: GRADO EN CIENCIAS POLÍTICAS Y DE LA ADMINISTRACIÓN Y DERECHO | E384: Mujer | F384: 50 | G384: 42 | H384: 8 | I384: 8 | J384: 3 | K384: 2 | L384: 2 | M384: 0 | N384: 2 | O384: 0 | P384: 0 | Q384: 0 | R384: 0 | S384: 0 | T384: 0 | U384: =F384+G384+H384+I384+J384+K384+L384+M384+N384+O384+P384+Q384+R384+S384+T384 -> 117
C385: LICENCIADO EN CIENCIAS POLÍTICAS Y DE LA ADMON. Y DERECHO | D385: =U385+U386 -> 286 | E385: Hombre | F385: 0 | G385: 0 | H385: 17 | I385: 26 | J385: 19 | K385: 16 | L385: 14 | M385: 10 | N385: 9 | O385: 4 | P385: 3 | Q385: 0 | R385: 1 | S385: 0 | T385: 1 | U385: =F385+G385+H385+I385+J385+K385+L385+M385+N385+O385+P385+Q385+R385+S385+T385 -> 120
C386: LICENCIADO EN CIENCIAS POLÍTICAS Y DE LA ADMON. Y DERECHO | E386: Mujer | F386: 0 | G386: 0 | H386: 27 | I386: 30 | J386: 21 | K386: 29 | L386: 23 | M386: 17 | N386: 13 | O386: 2 | P386: 1 | Q386: 0 | R386: 2 | S386: 1 | T386: 0 | U386: =F386+G386+H386+I386+J386+K386+L386+M386+N386+O386+P386+Q386+R386+S386+T386 -> 166
A387: E.INFORMAT-TELEC Y FAC. CC. | B387: 46 | C387: GRADO EN ING. INFORMÁTICA Y MATEMÁTICAS | D387: =U387+U388 -> 46 | E387: Hombre | F387: 22 | G387: 7 | H387: 1 | I387: 0 | J387: 0 | K387: 0 | L387: 0 | M387: 0 | N387: 0 | O387: 0 | P387: 0 | Q387: 0 | R387: 0 | S387: 0 | T387: 1 | U387: =F387+G387+H387+I387+J387+K387+L387+M387+N387+O387+P387+Q387+R387+S387+T387 -> 31
C388: GRADO EN ING. INFORMÁTICA Y MATEMÁTICAS | E388: Mujer | F388: 10 | G388: 5 | H388: 0 | I388: 0 | J388: 0 | K388: 0 | L388: 0 | M388: 0 | N388: 0 | O388: 0 | P388: 0 | Q388: 0 | R388: 0 | S388: 0 | T388: 0 | U388: =F388+G388+H388+I388+J388+K388+L388+M388+N388+O388+P388+Q388+R388+S388+T388 -> 15